C/R,Product,Application,DTS #,Description,Status (6.07),Pri,Ass'd DTSs,Releases,PP ,Programs,Date Checked,6.07 Chg #,Due Date,To Be Shipped (6.07),Shipping Test,Shipping Live,LSS,CCD,MU2,Resp App,Dev OK'd,Comments
,CS,MIS,17846,Remove Comment Column from Smoking Status in Social History Section on CCDs,Completed,3,,"6.0C, 6.07C, 6.08C, 6.1C, 6.13C, 6.14C, 6.15C",,MIS.XIO.ehr.build.cda.data,6/19/2015,MIS 2184,2/19/2015,,Y,Y,,Y,,,,
,CS,MIS,17847,IMMUN: Allow optional and pointer type queries for Language,Submitted,3,,6.07S,,,6/19/2015,,,,,,,,Y,,,
,CS,MIS,17851,INFCE: Provider Edits to LSS are not respecting msg generator parameters,Completed,3,,"6.0C, 6.07C, 6.08C",,MIS.DOC.xo.format.hl7.mpm,6/19/2015,MIS 2157,2/19/2015,,Y,Y,,,,,,
,CS,MIS,17853,Home Care 6.1: Patient insert not working,6.1-Completed,3,,"6.1C, 6.13C, 6.14C, 6.15C",,"MIS.XIO.hl7.dispatch.filers.insync, MIS.XIO.hl7.dispatch.filers.maestro",6/19/2015,,1/15/2015,,,,,,,,,
,CS,MIS,17857,CDA: Allergy coding does not support SNOMED,Completed,3,,"6.0C, 6.07C, 6.08C, 6.1C, 6.13C, 6.14C, 6.15C",,MIS.XML.UTIL.format.cda,6/19/2015,MIS 2155,1/15/2015,,Y,Y,,Y,,,,
,CS,MIS,17873,CCD/PHS: Vital Signs table does not display last results for all queries,Completed,3,Y,"6.0T, 6.07C, 6.08C, 6.1T, 6.13C, 6.14T, 6.15T",,"MIS.XIO.ehr.build.cda.data, MIS.XML.UTIL.format.cda",6/19/2015,MIS 2319,6/18/2015,Y,,,,Y,,,,
,CS,MIS,17883,INFCE: Inbound direct messages FAIL when sent to multiple recipients,Completed,3,,"6.0C, 6.07C, 6.08C, 6.1C, 6.13C, 6.14C, 6.15C",,"MIS.X.DEL.TYPE.http.synch.server, MIS.XML.PROTO.init, MIS.XML.UTIL.xi.file.iti.41, MIS.XML.UTIL.xi.file.iti.41.direct, MIS.XML.UTIL.xo.format.iti.41.response",6/19/2015,MIS 2233,6/18/2015,,Y,Y,,Y,,,,
,CS,MIS,17888,INFCE: Add Ability to Filter ITI-41 Generator Events based on Document Type,Completed,3,,"6.0C, 6.07C, 6.08C, 6.1C, 6.13C, 6.14C, 6.15C",,"MIS.XML.UTIL.xo.format.iti.41, MIS.XO.MSG.GEN.ee.xo.msg.parameters.xml.ovid",6/19/2015,MIS 2148,2/19/2015,,Y,Y,,Y,,,,
,CS,MIS,17891,INFCE: Fix MSH|9 in ACK messages to OTher Vendor,Completed,3,,"6.0C, 6.07C, 6.08C, 6.1C, 6.13C, 6.14C, 6.15C",,MIS.X.DEL.TYPE.from.hl7mp,6/19/2015,MIS 2234,2/19/2015,,Y,Y,,,Y,,,
,CS,MIS,17892,Misc Enhanced Value Set changes,Submitted,3,,"6.0S, 6.07S, 6.08S, 6.1S, 6.14S, 6.15S",,,6/19/2015,,,,,,,,,,,
,CS,MIS,17905,UTC/GMT Program Can Give Incorrect Times After Daylight Saving Time,Completed,3,,"6.0C, 6.07C, 6.08C, 6.1C, 6.13C, 6.14C, 6.15C",,MIS.XIO.utc.offset,6/19/2015,MIS 2264,5/21/2015,Y,,,,,Y,,,
,CS,MIS,17907,Infce: Add nomenclature to internal mapping utility wrapper,Completed,3,,"6.0C, 6.07C, 6.08C, 6.1C, 6.13C, 6.14C, 6.15C",,MIS.XIO.vset.map.2.flds,6/19/2015,MIS 2134,1/15/2015,,Y,Y,,,,,,
,CS,MIS,17920,INFCE - Allow site to define default provider for acknowledged CCD,Submitted,3,,6.07S,,,6/19/2015,,,,,,,Y,,,,
,CS,MIS,17927,INFCE: Can not define MSH for M-AT ADT,6.1-Completed,3,Y,"6.1C, 6.13C, 6.14C, 6.15C",,"MIS.XIO.focus.reg.to.hl7, MIS.XIO.focus.reg.to.hl7.hc, MIS.XIO.focus.reg.to.hl7.synd",6/19/2015,,4/16/2015,,,,,,Y,,,
,CS,MIS,17932,INFCE - HC NPR hook program needs to be seperate from ADT,6.1-Completed,3,,"6.1C, 6.13C, 6.14C, 6.15C",,"MIS.TOOL.BOX.init.x.msg.type, MIS.XIO.focus.reg.to.hl7.hc",6/19/2015,,4/16/2015,,,,,,,,,
,CS,MIS,17935,INFCE: MU2 CCD Interface: wizard not building ARCHIVE components correctly,6.1-Completed,3,,"6.1C, 6.15C",,MIS.XML.UTIL.cda.wizard,6/19/2015,,4/16/2015,,,,,Y,,,,
,CS,MIS,17936,Cancer CDA: provider componentOf wrong address tag and code attribute value,6.1-Completed,3,,"6.1C, 6.15C",,MIS.XML.UTIL.format.cancer.cda,6/19/2015,,1/15/2015,,,,,Y,,,,
,CS,MIS,17938,Interface: Add Onset Date To The CCD Encounter Section For Patient Problems,Completed,3,,"6.0C, 6.07C, 6.08C, 6.1C, 6.13C, 6.14C, 6.15C",,MIS.XIO.ehr.build.cda.data,6/19/2015,MIS 2185,6/18/2015,,Y,Y,,Y,,,,
,CS,MIS,17940,Update Online Help for Delivery Service Dictionary,Completed,3,Y,"6.0C, 6.07C, 6.08C, 6.1C, 6.13C, 6.14C, 6.15C",,MIS.X.DEL.SVC.im.ee.ip,6/19/2015,MIS 2276,4/16/2015,Y,,,,,,,,
,CS,MIS,17961,Infce: MIS Unit dictionary needs to collect new antibiotic units,Completed,3,Y,"6.0C, 6.07C, 6.08C, 6.1C, 6.13C, 6.14C, 6.15C",,MIS.X.UNIT.init,6/19/2015,MIS 2212,3/19/2015,,Y,Y,,,Y,,,
,CS,MIS,17969,INFCE: Interface Group Filter messages issue within IntMan (msgs not showing),Submitted,3,,"6.0S, 6.07S, 6.08S, 6.1S, 6.13S",,,6/19/2015,,,,,,,,,,,
,CS,MIS,17973,INFCE - Need to be able to suppress SSN from CCD,Submitted,3,,"6.0S, 6.07S, 6.08S, 6.1S, 6.15S",,,6/19/2015,,,,,,,Y,,,,
,CS,MIS,17984,ZMC record for the 3M HDM to ABS interface needs to be keyed,6.1-Completed,3,Y,"6.1C, 6.14C, 6.15C",,MIS.XIO.x.hook.hl7.to.focus.3m.hdm,6/19/2015,,3/19/2015,,,,,,,,,
,CS,MIS,17988,Create XML Parameter additions for MRI and ADM requests,Completed,3,,"6.0C, 6.07C, 6.08C, 6.1C, 6.13C, 6.14C, 6.15C",,MIS.XML.PROTO.init,6/19/2015,MIS 2149,3/19/2015,,Y,Y,,Y,,,,
,CS,MIS,17990,Message Generator changes to support state specific MU requirements,Completed,3,,"6.0C, 6.07C, 6.08C, 6.1C, 6.13C, 6.14C, 6.15C",,"MIS.XO.MSG.GEN.ee.mpg.driver.gen, MIS.XO.MSG.GEN.ee.public.hlth.msg.parameters",6/19/2015,MIS 2150,1/15/2015,,Y,Y,,,,,,
,CS,MIS,18004,INFCE: Restrictions not working for Syndromic Surveillance interface,Completed,3,,"6.0C, 6.07C, 6.08C",,MIS.XIO.xo.format.synd.surv.hl7,6/19/2015,MIS 2253,5/21/2015,Y,,,,,Y,,,
,CS,MIS,18009,INFCE: Message Generator Restriction Only Checks First Instance of Seg Header,Submitted,3,,"6.0S, 6.07S, 6.08S, 6.1S, 6.13S, 6.14S, 6.15S",,,6/19/2015,,,,,,,,,,,
,CS,MIS,18013,CDA Arhive Not indexing Acct URN for Cancer CDA,6.1-Completed,3,,"6.1C, 6.15C",,MIS.XML.UTIL.archive.cda.guts,6/19/2015,,4/16/2015,,,,,Y,,,,
,CS,MIS,18015,INFCE: Populate MSH|5 for Syndromic,Completed,3,Y,"6.0C, 6.07C, 6.08C",,"MIS.XIO.xo.format.synd.surv.hl7, MIS.XO.MSG.GEN.ee.mpg.driver.gen, MIS.XO.MSG.GEN.ee.mpg.driver.synd, MIS.XO.MSG.GEN.ee.mpg.driver.synd.msh, MIS.XO.MSG.GEN.ee.synd.mpg.driver",6/19/2015,MIS 2295,6/18/2015,Y,,,,,Y,,,
,CS,MIS,18019,Inbox/Outbox Message Reports Enter/Edit Screen Freezes,Completed,3,,"6.0C, 6.07C, 6.08C, 6.1C, 6.13C, 6.14C, 6.15C",,"MIS.XI.MSG.build.err.sel.open, MIS.XI.MSG.err.code.look",6/19/2015,MIS 2285,6/18/2015,Y,,,,,,,,
,CS,MIS,18021,Eligibility status for alternate EB codes datadef changes,Queued,3,Y,"6.0C, 6.07Q, 6.08C, 6.1C, 6.13C, 6.14C, 6.15C",,MIS.EDI.ansi.271.interpret,6/19/2015,,4/15/2015,,,,,,,,,
,CS,MIS,18031,Pt Monitors: retry queue not indexing/clearing properly; nil nodes,Completed,3,Y,"6.0C, 6.07C, 6.08C, 6.1C, 6.13C, 6.14C, 6.15C",,"MIS.XI.MSG.FILR.driver.foc.bilingual, MIS.XIO.build.ov.monitor.hl7.to.focus.link, MIS.XIO.x.hook.hl7.to.focus.oru.monitor",6/19/2015,MIS 2279,5/21/2015,Y,,,,,,,,
,CS,MIS,18037,INFC: Building HTTP or MIME header objects does not check for inactive object,Completed,3,,"6.0C, 6.07C, 6.08C, 6.1C, 6.13C, 6.14C, 6.15C",,MIS.XML.UTIL.build.object.header,6/19/2015,MIS 2259,5/21/2015,Y,,,,Y,,,,
,CS,MIS,18040,"INFCE - Parameterize UTC Offset for Syndromic, LAB, Immunizations Interfaces",Draft,3,Y,"6.0D, 6.07D, 6.08D, 6.1D, 6.14D, 6.15D",,"MIS.XIO.focus.immun.to.hl7, MIS.XIO.focus.reg.to.hl7.synd, MIS.XIO.xo.format.synd.surv.hl7, MIS.XO.MSG.GEN.ee.mpg.driver.gen",6/19/2015,,8/20/2015,,,,,,Y,,,
,CS,MIS,18048,"XML Dict: In Enter/Edit Parameters, Standard Entries Are Incorrectly Editable",Completed,3,,"6.0T, 6.07C, 6.08C, 6.1T, 6.13C, 6.14T, 6.15T",,MIS.XML.PARAMS.ee,6/19/2015,MIS 2267,6/18/2015,Y,,,,,,,,
,CS,MIS,18052,"Add ""Footprint"" flag to M-AT Message Generator",Completed,3,Y,"6.0C, 6.07C, 6.08C, 6.1C, 6.14C, 6.15C",,MIS.X.DEL.TYPE.from.bilingual.mat,6/19/2015,MIS 2172,2/19/2015,,Y,Y,,,,,,
,CS,MIS,18057,Syndromic Infce: Invalid Admit Diagnosis sent to State,Submitted,3,,"6.0S, 6.07S, 6.08S",,,6/19/2015,,,,,,,,Y,,,
,CS,MIS,18066,INFCE - Need option to always send family history section of CCD,Submitted,3,,"6.0S, 6.07S, 6.08S, 6.13S, 6.14S, 6.15S",,,6/19/2015,,,,,,,Y,,,,
,CS,MIS,18069,INFCE: add option for full LAB spec number to Medinet screen params,Completed,3,Y,"6.0C, 6.07C, 6.08C, 6.1C, 6.13C, 6.14C, 6.15C",,MIS.XO.MSG.GEN.ee.msg.medinet,6/19/2015,MIS 2237,6/18/2015,,Y,Y,,,,,,
,CS,MIS,18087,INFCE: Populate PV2|40 with Admission Level of Care - Syndromic Surveillance,Completed,3,,"6.0C, 6.07C, 6.08C",,"MIS.XIO.xo.format.get.all.appl.data, MIS.XIO.xo.format.synd.surv.hl7",6/19/2015,MIS 2296,8/20/2015,Y,,,,,Y,,,
,CS,MIS,18088,INFCE: Format changes to Hospital Discharge Section of CCD,Submitted,3,,6.07S,,,6/19/2015,,,,,,,Y,,,,
,CS,MIS,18093,"INFCE: Add ""PRELIM"",""INCOMP"" to CHOICES for LAB STATUS mapping",Completed,3,Y,"6.0C, 6.07C, 6.08C, 6.1C, 6.13C, 6.14C, 6.15C",,"MIS.X.DICT.MAP.ee, MIS.X.DICT.MAP.load.dict.values",6/19/2015,MIS 2213,3/19/2015,,Y,Y,,Y,,,,
,CS,MIS,18098,MFN: User Name Sent Incorrectly In STF|3,Completed,3,,"6.0C, 6.07C, 6.08C, 6.1C, 6.13C, 6.14C, 6.15C",,MIS.DOC.xo.format.hl7.comp,6/19/2015,MIS 2167,3/19/2015,,Y,Y,,,,,,
,CS,MIS,18103,++ CCD: Bilingual CCD's are not being indexed in MRI,6.1-Completed,3,,"6.1C, 6.15C",,MIS.XML.UTIL.bilingual.cda,6/19/2015,,2/19/2015,,,,,Y,,,,
,CS,MIS,18108,INFCE: M-AT Mapping Desktop crashes when Modified HL7 Field is changed,Completed,3,,"6.0C, 6.07C, 6.08C, 6.1C, 6.14C, 6.15C",,"MIS.X.HL7.FLD.view, MIS.XIO.hl7.mat.mapping.desktop.msg",6/19/2015,MIS 2223,5/21/2015,,Y,Y,,,,,,
,CS,MIS,18111,ITI: ITI-43 Requests are not going to FAIL read when response has errors,6.1-Submitted,3,,6.1S,,,6/19/2015,,,,,,,,,,,
,CS,MIS,18122,INFCE:MIME Field values that contain leading spaces don't save contents of doc,Submitted,3,,6.07S,,,6/19/2015,,,,,,,Y,,,,
,CS,MIS,18123,CCD: ITI-41 Formatter is crashing if document is not found in the FILE LIB,Submitted,3,,"6.0S, 6.07S, 6.08S, 6.1S, 6.14S, 6.15S",,,6/19/2015,,,,,,,Y,,,,
,CS,MIS,18126,Inbox: HL7 msgs to M-AT should fail if transform fails,Completed,3,,"6.0C, 6.07C, 6.08C, 6.1C, 6.13C, 6.14C, 6.15C",,MIS.XI.MSG.FILR.driver.foc.bilingual,6/19/2015,MIS 2280,6/18/2015,Y,,,,,,,,
,CS,MIS,18127,EDI: Messages unable to be searched in Interface Manager,Queued,3,Y,"6.0T, 6.07Q, 6.08Q, 6.1Q, 6.14Q, 6.15Q",,"MIS.EDI.xo.driver.ansi.270, MIS.X.DEL.TYPE.from.ansi271, MIS.XI.MSG.ansi.get.patient.info, MIS.XI.MSG.xo.format.hl7.focus, MIS.XIO.focus.pass.out",6/19/2015,,8/20/2015,,,,,,Y,,,
,CS,MIS,18128,CDA: Opt Out Query and Patient Confidential flag is not facility specific,Completed,3,,"6.0C, 6.07C, 6.08C, 6.1C, 6.13C, 6.14C, 6.15C",,"MIS.XML.PARAMS.view, MIS.XML.PROTO.init",6/19/2015,MIS 2239,6/18/2015,,Y,Y,,Y,,,,
,CS,MIS,18133,PERFORMANCE: Allow bilingual for EDI inbound,Queued,3,Y,"6.0T, 6.07Q, 6.08Q, 6.1Q, 6.14Q, 6.15Q",,"MIS.XI.MSG.FILR.driver.foc.bilingual, MIS.XIO.focus.pass.in",6/19/2015,,8/20/2015,,,,,,,,,
,CS,MIS,18136,CCD: Current visit pulling in Discharge Summary Report from previous visit,Submitted,3,,6.07S,,,6/19/2015,,,,,,,,,,,
,CS,MIS,18146,INFCE - File UB2 segments via inbound REG ADT,6.1-Completed,3,Y,"6.1C, 6.13C, 6.14C, 6.15C",,MIS.XIO.x.hook.hl7.to.focus.adt,6/19/2015,,3/19/2015,,,,,,,,,
,CS,MIS,18168,INFCE: Parameter needed to suppress CCDs for newborns,Submitted,3,,6.07S,,,6/19/2015,,,,,,,Y,,,,
,CS,MIS,18172,MPM Integration: File Authorizations into MT Acute through Z03 Messages,Completed,3,,"6.0C, 6.07C, 6.08C",,MIS.XIO.xi.query.hl7.focus,6/19/2015,MIS 2225,4/16/2015,,Y,Y,,,,,,
,CS,MIS,18176,Move RAD Site Mapping from MIS Toolbox to Interface Manager,Completed,3,,"6.0C, 6.07C, 6.08C, 6.1C, 6.13C, 6.14C, 6.15C",,"MIS.UI.DESK.init.mis, MIS.XIO.im.routines",6/19/2015,MIS 2292,6/18/2015,Y,,,,,,,,
,CS,MIS,18177,NMI:Interoperability Statistical Capture Enhancement Filer/Gen Params,Completed,3,,"6.0C, 6.07C, 6.08C, 6.1C, 6.13C, 6.14C, 6.15C",,"MIS.XI.MSG.FILR.ee, MIS.XI.MSG.FILR.ee.sirt.gather, MIS.XI.MSG.FILR.view, MIS.XI.MSG.FILR.view.sirt.gather, MIS.XIO.hl7.focus.mapping.desktop, MIS.XIO.hl7.mat.mapping.desktop.sirt.gather, MIS.XO.MSG.GEN.ee, MIS.XO.MSG.GEN.ee.sirt.gather, MIS.XO.MSG.GEN.view, MIS.XO.MSG.GEN.view.sirt.gather",6/19/2015,MIS 2240,3/19/2015,,Y,Y,,,,,,
,CS,MIS,18182,XI MSG FILR: EDI.271.5010 getting hung trying to file link,Submitted,3,,6.07S,,,6/19/2015,,,,,,,,,,,
,CS,MIS,18190,AMB Goals need to be moved to their own data segment,6.1-Completed,3,,"6.1C, 6.15C",,,6/19/2015,,2/19/2015,,,,,Y,,,,
,CS,MIS,18193,(Online Help) Add Metadata Screen to the MIS Toolbox Profile Dictionary,Draft,3,Y,"6.0D, 6.07D, 6.08D, 6.1D, 6.13D, 6.14D, 6.15D",,,6/19/2015,,,,,,,,,,,
,CS,MIS,18194,Third Party Billing parameter to be added for including DG1/GT1/IN1 Segments,Completed,3,,"6.0C, 6.07C, 6.08C, 6.1C, 6.13C, 6.14C, 6.15C",,MIS.XO.MSG.GEN.ee.msg.medinet,6/19/2015,MIS 2241,6/18/2015,,Y,Y,,,,,,
,CS,MIS,18200,INFCE: Unnecessary escaping of XML Characters,Submitted,3,,"6.07S, 6.13S, 6.14S",,,6/19/2015,,,,,,,Y,,,,
,CS,MIS,18201,Value Set Dictionary not filing to target HCIS,6.1-Submitted,3,,"6.1S, 6.13S, 6.14S, 6.15S",,,6/19/2015,,,,,,,,,,,
,CS,MIS,18203,INFCE - CCD Advanced Directive queries not in EMR-defined order,Submitted,3,,"6.07S, 6.15S",,,6/19/2015,,,,,,,Y,,,,
,CS,MIS,18207,Home Care Interface Components not Setup Correctly from Wizard,6.1-Submitted,3,,"6.0S, 6.08S, 6.15S",,,6/19/2015,,,,,,,,,,,
,CS,MIS,18208,INFCE: Send the speciality in PRA.5 for outbound provider update messages,Submitted,3,,6.07S,,,6/19/2015,,,,,,,,,,,
,CS,MIS,18213,INFCE: Name tag shouldn't be require to file Direct email body,Submitted,3,,"6.0S, 6.07S, 6.08S, 6.1S, 6.13S, 6.14S, 6.15S",,,6/19/2015,,,,,,,Y,,,,
,CS,MIS,18214,INFCE: Allow suppression of multiple ORC segments for ELR,Submitted,3,,6.07S,,,6/19/2015,,,,,,,,Y,,,
,CS,MIS,18218,INFCE: encoding escape characters can crash CDA disch summary build,Submitted,3,,"6.07S, 6.1S, 6.13S, 6.14S",,,6/19/2015,,,,,,,Y,,,,
,CS,MIS,18223,INFCE: Suppress Lab Result Messages with no OBX segments,Submitted,3,,"6.0S, 6.07S, 6.08S, 6.1S, 6.13S, 6.14S, 6.15S",,,6/19/2015,,,,,,,,Y,,,
,CS,MIS,18225,High Outbox backlogs and Performance issues,Completed,1,Y,"6.0C, 6.07C, 6.08C, 6.1C, 6.13C, 6.14C, 6.15C",,"MIS.EDI.ansi.270.elig, MIS.EDI.xo.driver.ansi.278, MIS.XIO.on.condition.hang, MIS.XO.EVENT.Q.abs.file, MIS.XO.EVENT.Q.file",6/19/2015,MIS 2195,3/6/2015,,Y,Y,,,,,,
,CS,MIS,18227,Delivery Services changes to extract facility components from MSH|4 and MSH|6,Completed,3,,"6.0C, 6.07C, 6.08C, 6.1C, 6.13C, 6.14C, 6.15C",,MIS.X.DEL.SVC.find.msg.type,6/19/2015,MIS 2242,7/16/2015,,Y,Y,,,,,,
,CS,MIS,18231,Create Online Help for Modified HL7 Field Dictionary,Draft,3,Y,"6.0D, 6.07D, 6.08D, 6.1D, 6.14D, 6.15D",,,6/19/2015,,7/16/2015,,,,,,,,,
,CS,MIS,18240,INFCE: Msg Gen not processing events,Completed,3,,"6.0C, 6.07C, 6.08C, 6.1C, 6.13C, 6.14C, 6.15C",,MIS.XO.EVENT.Q.driver,6/19/2015,MIS 2244,6/18/2015,,Y,Y,,,,,,
,CS,MIS,18241,Allow OIDs to be entered as the receiving facility,Submitted,3,,"6.0S, 6.07S, 6.08S, 6.1S, 6.13S, 6.14S, 6.15S",,,6/19/2015,,,,,,,,,,,
,CS,MIS,18257,"DEL SVC TYPE ""HTTP Network"" Should be initialized as inactive",Completed,3,,"6.0C, 6.07C, 6.08C, 6.1C, 6.13C, 6.14C, 6.15C",,MIS.X.DEL.TYPE.init,6/19/2015,MIS 2278,6/18/2015,Y,,,,,,,,
,CS,MIS,18262,INFCE: ARCHIVE.CDA missing PatEthnicity hookpoint in 6.1x,6.1-Submitted,3,,6.14S,,,6/19/2015,,,,,,,Y,,,,
,CS,MIS,18266,NMI - Add smart search functionality,Completed,3,,"6.0C, 6.07C, 6.08C, 6.1C, 6.14C, 6.15C",,MIS.XIO.xi.smart.search,6/19/2015,MIS 2260,5/21/2015,Y,,,,,,,,
,CS,MIS,18269,XDR - Add custom subject and email body that contains name and other fields,Completed,3,,"6.0T, 6.07C, 6.08C, 6.1T, 6.13C, 6.14T, 6.15T",,"MIS.XML.PROTO.init, MIS.XML.UTIL.ee.cda.configuration.params, MIS.XML.UTIL.format.xd.metadata, MIS.XML.UTIL.xo.format.iti.41",6/19/2015,MIS 2312,6/18/2015,Y,,,,Y,,,,
,CS,MIS,18270,NMI - Include Middle Name in Import Clinical Summary Routine,Completed,3,Y,"6.0T, 6.07C, 6.08C, 6.1T, 6.13C, 6.14T, 6.15T",,"MIS.X.OBJECT.init, MIS.XML.UTIL.cda.import.manual, MIS.XML.UTIL.format.cda",6/19/2015,MIS 2320,6/18/2015,Y,,,,Y,,,,
,CS,MIS,18280,INFCE: Populate Syndromic with PV1|7 as Emergency Physician,Submitted,3,,"6.0S, 6.07S, 6.08S",,,6/19/2015,,,,,,,,Y,,,
,CS,MIS,18282,INFCE: NTE segments for Queries appear in 'nomen' LAB Result message,Completed,3,Y,"6.0C, 6.07C, 6.08C, 6.1C, 6.13Q, 6.14C, 6.15C",,MIS.X.QUERY.MAP.ee.query.multi.driver,6/19/2015,MIS 2298,7/16/2015,Y,,,,,Y,,,
,CS,MIS,18283,INFCE - Long fields from M-AT may not be formatted correctly,Completed,3,,"6.0C, 6.07C, 6.08C, 6.1C, 6.13C, 6.14C, 6.15C",,"MIS.XIO.focus.absacct.to.hl7, MIS.XIO.focus.cwsappt.to.hl7, MIS.XIO.focus.immun.to.hl7, MIS.XIO.focus.om.diet.to.hl7, MIS.XIO.focus.om.to.hl7, MIS.XIO.focus.reg.to.hl7, MIS.XIO.focus.reg.to.hl7.empi, MIS.XIO.focus.reg.to.hl7.hc, MIS.XIO.focus.reg.to.hl7.synd, MIS.XIO.focus.sca.img.to.hl7, MIS.XIO.focus.surcase.to.hl7, MIS.XIO.focus.to.hl7, Z.lite.decompose",6/19/2015,MIS 2255,5/21/2015,Y,,,,,Y,,,
,CS,MIS,18291,INFCE: Manually deliver should return error for bilingual,Submitted,3,,"6.0S, 6.07S, 6.08S, 6.1S, 6.13S, 6.14S, 6.15S",,,6/19/2015,,,,,,,,,,,
,CS,MIS,18298,"CCD: When importing CCD's with ns defs>255, CCD Cant be viewed from PCM",Testing,3,,"6.0T, 6.07T, 6.08T, 6.1T, 6.13T, 6.14T, 6.15T",,"MIS.XML.UTIL.get.cda.for.view.mobile, MIS.XML.UTIL.get.cda.for.view.npr",6/19/2015,,5/21/2015,,,,,Y,,,,
,CS,MIS,18299,Misc naming and placement changes for MIS Value Set Dictionaries,Completed,3,,"6.0C, 6.07C, 6.08C, 6.1C, 6.14C, 6.15C",,"MIS.X.CODE.SYS.ee, MIS.X.CODE.SYS.list, MIS.X.CODE.SYS.view, MIS.X.DICT.MAP.ee, MIS.X.QUERY.MAP.ask.facility, MIS.X.QUERY.MAP.ee, MIS.X.QUERY.MAP.ee.query.multi.driver, MIS.X.UNIT.ee, MIS.X.UNIT.init, MIS.X.VALUE.SET.ee, ~.infce.mapping.menu, ~.infce.mapping.menu.old, ~.infce.value.set.map",6/19/2015,MIS 2299,8/20/2015,Y,,,,Y,,,,
,CS,MIS,18312,PV1|2 can be blank in Synd message due to mapping issue with EDVISDX event,Completed,3,,"6.0C, 6.07C, 6.08C",,MIS.XIO.xo.format.get.all.appl.data,6/19/2015,MIS 2300,7/16/2015,Y,,,,,Y,,,
,CS,MIS,18314,INFCE: Need program to get M-AT info from NPR for interfaces,Submitted,3,,"6.0S, 6.07S, 6.08S, 6.1S, 6.13S, 6.14S, 6.15S",,,6/19/2015,,,,,,,,,,,
,CS,MIS,18324,MIS event queue: needs generic utility to generate queue URN,Completed,3,Y,"6.0T, 6.07C, 6.08C, 6.1T, 6.13C, 6.14T, 6.15T",,"MIS.EDI.ansi.270.elig, MIS.EDI.xo.driver.ansi.278, MIS.XO.EVENT.Q.abs.file, MIS.XO.EVENT.Q.file, MIS.XO.EVENT.Q.new.event.urn",6/19/2015,MIS 2269,7/16/2015,Y,,,,,,,,
,CS,MIS,18327,INFCE - Additional information required in ITI-44 Organization ID,Submitted,3,,"6.0S, 6.05S, 6.07S, 6.08S, 6.1S, 6.15S",,,6/19/2015,,,,,,,Y,,,,
,CS,MIS,18331,INFCE: New Filer parameter to READ-WARN on invalid OBX-3,Completed,3,Y,"6.0C, 6.07C, 6.08C, 6.1C, 6.13C, 6.14C, 6.15C",,"MIS.XI.MSG.FILR.ee.msg.medinet.res, MIS.XI.MSG.FILR.view.msg.medinet.res",6/19/2015,MIS 2270,5/21/2015,Y,,,,,,,,
,CS,MIS,18332,INFCE: Value Set Map Default Value Issues,Submitted,3,,"6.0S, 6.07S, 6.08S, 6.1S, 6.13S, 6.14S, 6.15S",,,6/19/2015,,,,,,,,Y,,,
,CS,MIS,18334,INFCE: Unpack HL7 fields program incorrectly parsing long repetition fields,Queued,3,,"6.0Q, 6.07Q, 6.08Q, 6.1Q, 6.14Q, 6.15Q",,MIS.XIO.unpack.fields.hl7,6/19/2015,,10/15/2015,,,,,,,,,
,CS,MIS,18344,"Cancer CDA: TNM info nillflavors, referred to doc and Multi procedures",6.1-Testing,3,,"6.1T, 6.15T",,"MIS.XIO.ehr.build.cda.data, MIS.XML.UTIL.format.cancer.cda",6/19/2015,,5/21/2015,,,,,Y,,,,
,CS,MIS,18347,INFCE: Problem Name in text tag is overwritten by displayName attribute,Submitted,3,,"6.07S, 6.15S",,,6/19/2015,,,,,,,Y,,,,
,CS,MIS,18348,(Online Help) Update Message Generator Dictionary with SIRT Changes,Draft,3,Y,"6.0D, 6.07D, 6.08D, 6.1D, 6.13D, 6.14D, 6.15D",,,6/19/2015,,,,,,,,,,,
,CS,MIS,18372,INFCE: Language code description needed in CCD and Patient Portal,Submitted,3,,"6.07S, 6.14S",,,6/19/2015,,,,,,,Y,,,,
,CS,MIS,18373,CCD: Imported CCD's Allergy section are not always gathering correctly,Completed,3,,"6.0T, 6.07C, 6.08C, 6.1T, 6.13C, 6.14C, 6.15C",,"MIS.XML.UTIL.extract.discrete.cda, MIS.XML.UTIL.format.cda.to.focus",6/19/2015,MIS 2265,6/18/2015,Y,,,,Y,,,,
,CS,MIS,18374,Add ability to view the M-AT list sent to PCS for the Waveform Interface,6.1-Testing,3,,"6.1T, 6.14T, 6.15T",,MIS.XIO.xi.file.waveform,6/19/2015,,6/18/2015,,,,,,,,,
,CS,MIS,18382,"INFCE: ""Document Source is missing"" when source is not in first author section",Submitted,3,,6.07S,,,6/19/2015,,,,,,,Y,,,,
,CS,MIS,18388,INFCE: Add MIS Triage dictionary to dictionary mapping routines,Completed,3,,"6.0C, 6.07C, 6.08C, 6.1C, 6.13C, 6.14C, 6.15C",,"MIS.X.DICT.MAP.ee, MIS.X.DICT.MAP.id, MIS.X.MSG.TYPE.ee.hook.points2",6/19/2015,MIS 2301,7/16/2015,Y,,,,Y,,,,
,CS,MIS,18398,INFCE: ITI.41 messages missing MRN in PID|3,Submitted,3,,6.07S,,,6/19/2015,,,,,,,,Y,,,
,CS,MIS,18402,"SSL Delivery Service utility change missing from Q thru C in 6.14, 6.15",6.1-Queued,3,Y,"6.14Q, 6.15Q",,MIS.X.DEL.SVC.ssl,6/19/2015,,7/16/2015,,,,,,,,,
,CS,MIS,18417,CCD: Direct message issues - Existing messages always get Source Match Error,Completed,3,,"6.0T, 6.07C, 6.08C, 6.1T, 6.13C, 6.14T, 6.15T",,"MIS.XML.UTIL.xo.format.iti.41, MIS.XO.MSG.GEN.ee.xo.msg.parameters.xml",6/19/2015,MIS 2314,8/20/2015,Y,,,,Y,,,,
,CS,MIS,18423,CDA: ARCHIVE.CDA encounters error in 6.1x if no 6.0x historical HCIS defined,6.1-Testing,3,,"6.1T, 6.14T, 6.15T",,MIS.XIO.ehr.build.cda.data,6/19/2015,,7/16/2015,,,,,Y,,,,
,CS,MIS,18427,INFCE: View Human Readable CCD via Fields Tab in Interface Manager,,3,,,,,6/19/2015,,,,,,,Y,,,,
,CS,MIS,18431,INFCE: Messages stuck in READING due to MRI database being closed,Submitted,3,,6.07S,,,6/19/2015,,,,,,,,,,,
,CS,MIS,18437,CDA: sites should have a way to view contents of CDA archive,Completed,3,,"6.0C, 6.07C, 6.08C, 6.1C, 6.14C, 6.15C",,MIS.XML.UTIL.view.cda.archive,6/19/2015,MIS 2266,5/21/2015,Y,,,,Y,,,,
,CS,MIS,18438,INFCE - CDA Wizard does not properly build STRT.GET.CHT when first run,Submitted,3,,6.07S,,,6/19/2015,,,,,,,Y,,,,
,CS,MIS,18445,INFCE: EDI - Dataset not capturing all segment field values,Submitted,3,,6.07S,,,6/19/2015,,,,,,,,,,,
,CS,MIS,18449,REG ADT - DTS MIS 17927 removes ability to define message type in MSH|9,6.1-Submitted,3,,"6.1S, 6.13S, 6.14S, 6.15S",,,6/19/2015,,,,,,,,,,,
,CS,MIS,18451,"INFCE: Allow ""application/soap+xml"" Media Subtype",Submitted,3,,"6.0S, 6.07S, 6.1S, 6.14S, 6.15S",,,6/19/2015,,,,,,,Y,,,,
,CS,MIS,18458,CCD: SAML 2.0 Changes needed for Certification,Completed,3,,"6.0T, 6.07C, 6.08C, 6.1T, 6.14T, 6.15T",,"MIS.XML.PROTO.init, MIS.XML.UTIL.format.saml.20, Z.sign.xml",6/19/2015,MIS 2315,8/20/2015,Y,,,,Y,,,,
,CS,MIS,18462,CDAs logged as ineligible for MU2 upon archive logged as eligible upon xmit,Completed,3,,"6.0T, 6.07C, 6.08C, 6.1T, 6.13C, 6.14T, 6.15T",,"MIS.XML.UTIL.get.cda.guid, MIS.XML.UTIL.xo.format.iti.41, MIS.XML.UTIL.xo.format.smtp",6/19/2015,MIS 2316,6/18/2015,Y,,,,Y,,,,
,CS,MIS,18465,Copay Note tag not displaying for Formulary,,3,,6.0T,,MIS.FBD.drug.coverage.drfirst.process.resp,6/19/2015,,,,,,,,,,,
,CS,MIS,18474,INFCE: CCD Creating Extra ITI-41 Messages,Submitted,3,,"6.0S, 6.07S, 6.1S, 6.14S, 6.15S",,,6/19/2015,,,,,,,Y,,,,
,CS,MIS,18483,New parameter needed to send single OBX,Completed,3,,"6.0C, 6.07C, 6.08C, 6.1C, 6.14C, 6.15C",,MIS.XO.MSG.GEN.ee.xo.msg.parameters,6/19/2015,MIS 2248,5/21/2015,,Y,Y,,,,,,
,CS,MIS,18484,HL7 Network Delivery type:Issues calling response pgm cause delivery to halt,Draft,3,,"6.0D, 6.07D, 6.08D, 6.1D, 6.14D, 6.15D",,MIS.X.DEL.TYPE.del.hl7mp,6/19/2015,,9/17/2015,,,,,,,,,
,CS,MIS,18485,Changes needed for the ITI Wizard to increase stability and ease of use,6.1-Submitted,3,,6.1S,,,6/19/2015,,,,,,,,,,,
,CS,MIS,18486,LAB SITE parameter needed for LAB 13049,Completed,3,,"6.0C, 6.07C, 6.08C, 6.1C, 6.14C, 6.15C",,MIS.XI.MSG.FILR.ee.msg.medinet.res,6/19/2015,MIS 2271,5/21/2015,Y,,,,,,,,
,CS,MIS,18493,HL7 Phone Comp Not Handling Certain Extension Formats,Completed,3,Y,"6.0C, 6.07C, 6.08C, 6.1C, 6.14C, 6.15C",,MIS.XIO.hl7.phone.comp,6/19/2015,MIS 2262,,Y,,,,,,,,
,CS,MIS,18500,INFCE: Allow users to requeue SENT messages,Submitted,3,,"6.0S, 6.07S, 6.1S, 6.13S, 6.14S, 6.15S",,,6/19/2015,,,,,,,,,,,
,CS,MIS,18502,INFCE: Implement override for Provider ID's (for Consulting/Other Docs),Completed,3,Y,"6.0C, 6.07C, 6.08C, 6.1C, 6.13Q, 6.14C, 6.15C",,MIS.XIO.hl7.doc,6/19/2015,MIS 2302,7/16/2015,Y,,,,,Y,,,
,CS,MIS,18503,Move missing data segment through the pipeline to resolve translation issues,Completed,3,,6.07C,,,6/19/2015,MIS 2272,,Y,,,,,,,,
,CS,MIS,18519,Add Code to Stabilize Unfinished Procedure,,3,Y,"6.0C, 6.08C",,MIS.X.DEL.SVC.ee.ssl.ehr,6/19/2015,,5/21/2015,,,,,,,,,
,CS,MIS,18520,INFCE: MPM RT job can file invalid queries,Submitted,3,,"6.0S, 6.07S, 6.1S, 6.14S, 6.15S",,,6/19/2015,,,,,,,,,,,
,CS,MIS,18522,CCD: Discrete XML does not match the Narrative XML for duplicate Lab Results,6.1-Submitted,3,,6.1S,,,6/19/2015,,,,,,,,,,,
,CS,MIS,18525,"WPL: Viewing CCD, Web browser does not launch in WPL mode",6.1-Testing,3,Y,"6.1T, 6.15T",,"MIS.RT.INTEG.send.req.to.focus.mis, MIS.XML.UTIL.test.format.cda, MIS.XML.UTIL.test.view.cda.archive, MIS.XML.UTIL.view.cda.archive",6/19/2015,,7/16/2015,,,,,Y,,,,
,CS,MIS,18527,AVERA INFCE: New parameter for LAB Orders IN to search HIM,Completed,3,,"6.0C, 6.07C, 6.08C, 6.1C, 6.14C, 6.15C",,MIS.XI.MSG.FILR.ee.msg.medinet,6/19/2015,MIS 2273,5/21/2015,Y,,,,,,,,
,CS,MIS,18530,WAVEFORM - Messages stuck in QUEUED in delivery service,6.1-Submitted,3,,"6.1S, 6.14S, 6.15S",,,6/19/2015,,,,,,,,,,,
,CS,MIS,18535,INFCE: ITI-45 not generating ITI-41 messages after CS MIS 17888,Submitted,3,,"6.07S, 6.1S",,,6/19/2015,,,,,,,Y,,,,
,CS,MIS,18542,CCD: Clinical Summaries are not being logged when created via RT connection,6.1-Queued,3,,"6.1Q, 6.15Q",,MIS.XML.UTIL.bilingual.cda,6/19/2015,,8/20/2015,,,,,Y,,,,
,CS,MIS,18559,TCP: TCP response messages are missing HTTP status header,6.1-Completed,3,,"6.0C, 6.08C, 6.1C, 6.14C, 6.15C",,MIS.X.DEL.TYPE.http.synch.server,6/19/2015,,5/21/2015,,,,,Y,,,,
