C/R,Product,Application,DTS #,Description,Status (6.07),Pri,Ass'd DTSs,Releases,PP ,Programs,Date Checked,6.07 Chg #,Due Date,To Be Shipped (6.07),Shipping Test,Shipping Live,LSS,CCD,MU2,Resp App,Dev OK'd,Comments
,CS,MIS,16012,"Inpatient Summary missing Meds, Allergies, Problems, Immunizations in 6.1x",Completed,3,,"6.0C, 6.07C, 6.08C, 6.1C, 6.13C, 6.14C",4,MIS.XIO.ehr.build.cda.data,6/19/2015,MIS 1598,12/9/2013,,Y,Y,,Y,,,,
,CS,MIS,16021,XML extract attributes program omits checking last character for single quote,Completed,3,,"6.0C, 6.07C, 6.08C, 6.1C, 6.13C, 6.14C, 6.15C",4,MIS.XML.UTIL.xml.extract.attributes,6/19/2015,MIS 1716,12/20/2013,,Y,Y,,Y,,,,
,CS,MIS,16041,CDA: problem code not appearing if SNOMED_CT,Completed,3,,"6.0C, 6.07C, 6.08C, 6.1C, 6.13C, 6.14C",4,MIS.XML.UTIL.format.cda,6/19/2015,MIS 1599,12/21/2013,,Y,Y,,Y,,,,
,CS,MIS,16061,Syndromic Surveillance: Service field not being mapped,Completed,3,,"6.0C, 6.07C, 6.08C",4,MIS.XIO.xo.format.synd.surv.hl7,6/19/2015,MIS 1643,12/21/2013,,Y,Y,,,Y,,,
,CS,MIS,16082,HTTP Service Delivery type is no longer compatible with Choose and Book,Completed,3,,"6.0C, 6.07C, 6.08C, 6.1C, 6.13C, 6.14C, 6.15C",4,MIS.X.DEL.TYPE.init,6/19/2015,MIS 1719,1/3/2014,,Y,Y,,,,,,
,CS,MIS,16124,SYND - OBX|5 not populating correctly for Date of Onset,Completed,3,,"6.0C, 6.07C, 6.08C, 6.1C, 6.13C, 6.14C",4,"MIS.XIO.focus.reg.to.hl7.synd, MIS.XIO.xo.format.synd.surv.hl7",6/19/2015,MIS 1644,1/21/2014,,Y,Y,,,Y,,,
,CS,MIS,16136,"INFCE - CCD Effective Date/Time always ""UNK"" for vital signs coded sections",Completed,3,,"6.0C, 6.07C, 6.08C, 6.1C, 6.13C, 6.14C",4,MIS.XML.UTIL.format.cda,6/19/2015,MIS 1647,1/25/2014,,Y,Y,,Y,,,,
,CS,MIS,16145,Only the first document in a XDR package is filing to Direct Messaging Deskto,Completed,4,,"6.0C, 6.07C, 6.08C, 6.1C, 6.13C, 6.14C, 6.15C",4,MIS.XML.UTIL.xi.file.iti.41.direct,6/19/2015,MIS 1752,5/21/2014,,Y,Y,,Y,,,,
,CS,MIS,16164,INFCE - Always listing procedures as completed in CCD,Completed,3,Y,"6.0C, 6.07C, 6.08C, 6.1C, 6.13C, 6.14C, 6.15C",5,MIS.XIO.ehr.build.cda.data,6/19/2015,MIS 1773,4/17/2014,,Y,Y,,Y,,,,
,CS,MIS,16175,DDP 18687: HCA PWR 32616 - Infce Functionality to support Undefined Providers,Completed,3,Y,"6.0C, 6.07C, 6.08C",4,MIS.XIO.hl7.doc,6/19/2015,MIS 1689,,,Y,Y,,,,,,
,CS,MIS,16208,SYND - Pregnancy query not sent in message,Completed,3,,"6.0C, 6.07C, 6.08C",5,"MIS.X.QUERY.MAP.ask.facility, MIS.XIO.xo.format.synd.surv.hl7, MIS.XO.MSG.GEN.ee.public.hlth.msg.parameters",6/19/2015,MIS 1797,3/20/2014,,Y,Y,,,Y,,,
,CS,MIS,16210,INFCE: LAB RES ACP/PH wizard should not set up # as an encoding character,Completed,3,Y,"6.0C, 6.07C, 6.08C, 6.1C, 6.13C, 6.14C",4,MIS.XIO.build.lab.res.arra,6/19/2015,MIS 1677,2/20/2014,,Y,Y,,,Y,,,
,CS,MIS,16212,"CDA:  ""<"" or "">"" in Lab result comment makes CDA undisplayable",Completed,3,,"6.0C, 6.07C, 6.08C, 6.1C, 6.13C, 6.14C",4,MIS.XML.UTIL.format.cda,6/19/2015,MIS 1648,1/26/2014,,Y,Y,,Y,,,,
,CS,MIS,16217,INFCE: RAD Results Outbound msgs not accounting for timezone offset,Completed,3,,"6.0C, 6.07C, 6.08C, 6.1C, 6.13C, 6.14C, 6.15C",5,MIS.XO.EVENT.Q.driver.pacs,6/19/2015,MIS 1869,1/16/2014,,Y,Y,,,,,,
,CS,MIS,16220,INFCE: CCD Lab results are displayed by result test rather than print number,Completed,3,,"6.0C, 6.07C, 6.08C, 6.1C, 6.13C, 6.14C, 6.15C",5,"MIS.XIO.ehr.build.cda.data, MIS.XML.UTIL.format.cda",6/19/2015,MIS 1774,5/15/2014,,Y,Y,,Y,,,,
,CS,MIS,16228,INFCE EHR - Add parameter for Provider Type,Completed,3,,"6.0C, 6.07C, 6.08C, 6.1C, 6.13C, 6.14C, 6.15C",4,MIS.XO.MSG.GEN.ee.msg.medinet.res,6/19/2015,MIS 1699,2/20/2014,,Y,Y,,,Y,,,
,CS,MIS,16229,INFCE: MIS Query Map Enter/Edit: unable to make Y/N entries,Completed,3,,"6.0C, 6.07C, 6.08C, 6.1C, 6.13C, 6.14C, 6.15C",5,MIS.X.QUERY.MAP.ee,6/19/2015,MIS 1853,1/16/2014,,Y,Y,,,,,,
,CS,MIS,16233,INFCE: add delivery service trap functionality to AutoFolder delivery type,Submitted,3,,"6.05S, 6.06S, 6.07S",,,6/19/2015,,,,,,,,,,,
,CS,MIS,16245,INFCE - Syndromic Interface not sending Reason for Visit after 14828,Completed,3,,"6.0C, 6.07C, 6.08C",4,MIS.XIO.xo.format.synd.surv.hl7,6/19/2015,MIS 1645,1/16/2014,,Y,Y,,,Y,,,
,CS,MIS,16246,DDPs 16538/18283: Value Set Import Function,Completed,3,Y,"6.0C, 6.07C, 6.08C, 6.1C, 6.13C, 6.14C",4,"MIS.X.VALUE.SET.ee2, MIS.X.VALUE.SET.import2",6/19/2015,MIS 1673,,,Y,Y,,Y,,,,
,CS,MIS,16265,CDA: Log SOAP Message ID to ADM/REG for reporting,Completed,3,Y,"6.0C, 6.07C, 6.08C, 6.1C, 6.13C, 6.14C",4,"MIS.X.DEL.TYPE.del.http, MIS.XML.UTIL.archive.cda, MIS.XML.UTIL.log.cda, MIS.XML.UTIL.xo.format.iti.41",6/19/2015,MIS 1642,,,Y,Y,,Y,,,,
,CS,MIS,16281,CCD: CCD missing historical Problems and Medications,Completed,3,Y,"6.0C, 6.07C, 6.08C, 6.1C, 6.13C, 6.14C",4,"MIS.XIO.ehr.build.cda.data, MIS.XML.UTIL.format.cda",6/19/2015,MIS 1649,,,Y,Y,,Y,,,,
,CS,MIS,16283,Inbound Del Service can create multiple Inbound Msg from same file,Completed,3,,"6.0C, 6.07C, 6.08C, 6.1C, 6.13C, 6.14C, 6.15C",,"MIS.X.DEL.TYPE.from.folder.index.filename, MIS.X.DEL.TYPE.from.folder.to.appl",6/19/2015,MIS 2127,9/25/2014,,Y,Y,,,,,,
,CS,MIS,16284,DDP 18283: Outbound Mapping Utility,Completed,3,Y,"6.0C, 6.07C, 6.08C, 6.1C, 6.13C, 6.14C",4,"MIS.XIO.map, MIS.XIO.map2, MIS.XO.MSG.GEN.ee",6/19/2015,MIS 1675,,,Y,Y,,,,,,
,CS,MIS,16289,"ITI-41 - Metadata Classification ""nodeRepresentation"" Attribute Missing",Completed,3,,"6.0C, 6.07C, 6.08C, 6.1C, 6.13C, 6.14C, 6.15C",5,"MIS.XML.PROTO.init, MIS.XML.UTIL.format.xd.metadata",6/19/2015,MIS 1775,4/17/2014,,Y,Y,,Y,,,,
,CS,MIS,16290,Value Sets:  RT connection to M-AT needs rewrite to fix M-AT crash,Completed,3,Y,"6.0C, 6.07C, 6.08C, 6.1C, 6.13C, 6.14C, 6.15C",4,"MIS.X.VALUE.SET.ee, MIS.X.VALUE.SET.xo.format.npr.to.mat",6/19/2015,MIS 1703,2/20/2014,,Y,Y,,Y,,,,
,CS,MIS,16296,INFCE: Scheduled Report Background Jobs crash on NPR.UI.m.misc when running,Completed,3,,"6.0C, 6.07C, 6.08C, 6.1C, 6.13C, 6.14C, 6.15C",5,MIS.XIO.REPORT.run,6/19/2015,MIS 1916,3/20/2014,,Y,Y,,,,,,
,CS,MIS,16309,DDP 18283: Value Set content creation,Completed,3,Y,"6.0C, 6.07C, 6.08C, 6.1C, 6.13C, 6.14C",4,"MIS.X.CODE.SYS.init2, MIS.X.VALUE.SET.init2, MIS.X.VALUE.SET.init2.cda, MIS.X.VALUE.SET.init2.lri.acp, MIS.X.VALUE.SET.init2.phvs, MIS.XIO.map.init2, ~.infce.mapping, ~.infce.mapping.menu, ~.infce.mapping.menu.old",6/19/2015,MIS 1676,,,Y,Y,,Y,,,,
,CS,MIS,16317,SERVICE not displaying in IntMan Del Service TCP/IP info screen,Submitted,3,,"6.0S, 6.07S, 6.08S, 6.1S, 6.13S, 6.14S, 6.15S",,,6/19/2015,,,,,,,,,,,
,CS,MIS,16318,Update ITI-44 and ITI-45 with new outbox.id macro,Completed,3,,6.07C,4,"MIS.XML.UTIL.xo.format.iti.44, MIS.XML.UTIL.xo.format.iti.45",6/19/2015,MIS 1713,2/20/2014,,Y,Y,,Y,,,,
,CS,MIS,16338,DDP 18283: Update CDA Hook Points,Completed,3,Y,"6.0C, 6.07C, 6.08C, 6.1C, 6.13C, 6.14C",4,"MIS.XML.UTIL.format.cda, MIS.XML.UTIL.iti.wizard",6/19/2015,MIS 1681,,,Y,Y,,Y,,,,
,CS,MIS,16347,"Req:DDP 18689: Include Surgical Procedures on CCDA (NMI changes, Phase 2)",Completed,3,Y,"6.0C, 6.07C, 6.08C, 6.1C, 6.13C, 6.14C",4,"MIS.XIO.ehr.build.cda.data, MIS.XML.UTIL.format.cda",6/19/2015,MIS 1682,,,Y,Y,,Y,,,,
,CS,MIS,16350,INFCE - CCD ClinicalDocument tag contains malformed namespaces,Completed,3,,"6.0C, 6.07C, 6.08C, 6.1C, 6.13C, 6.14C, 6.15C",4,MIS.XML.UTIL.xo.format.iti.41,6/19/2015,MIS 1730,2/20/2014,,Y,Y,,Y,,,,
,CS,MIS,16355,INFCE - CCD only displays first response of a multi-response query,Completed,3,,"6.0C, 6.07C, 6.08C, 6.1C, 6.13C, 6.14C, 6.15C",4,MIS.XIO.ehr.build.cda.data,6/19/2015,MIS 1700,2/20/2014,,Y,Y,,Y,,,,
,CS,MIS,16359,DDP 18283: Outstanding issues for Value Set redesign.,Completed,3,Y,"6.0C, 6.07C, 6.08C, 6.1C, 6.13C, 6.14C, 6.15C",5,"MIS.X.DICT.MAP.ee2, MIS.X.DICT.MAP.id, MIS.X.DICT.MAP.inbound.ee, MIS.X.DICT.MAP.inbound.view, MIS.X.DICT.MAP.load.dict.values, MIS.X.DICT.MAP.view2, MIS.X.DICT.MAP.xo.format.npr.to.mat2, MIS.X.MSG.TYPE.ee.hook.points2, MIS.X.QUERY.MAP.id, MIS.X.QUERY.MAP.inbound.ee, MIS.X.QUERY.MAP.inbound.view, MIS.X.QUERY.MAP.load.and.link, MIS.X.QUERY.MAP.outbound.ee, MIS.X.QUERY.MAP.outbound.view, MIS.X.QUERY.MAP.xo.format.npr.to.mat2, MIS.X.VALUE.SET.ee2, MIS.X.VALUE.SET.xo.format.npr.to.mat2, MIS.XIO.map2, MIS.XO.MSG.GEN.ee.hook.points2, ~.infce.mapping.menu",6/19/2015,MIS 1799,4/17/2014,,Y,Y,,Y,,,,
,CS,MIS,16377,INFCE - ARCHIVE.CDA job queueing duplicate events in error,Completed,3,,"6.0C, 6.07C, 6.08C, 6.1C, 6.13C, 6.14C, 6.15C",5,MIS.XML.UTIL.archive.cda,6/19/2015,MIS 1852,6/19/2014,,Y,Y,,Y,,,,
,CS,MIS,16380,Inbox/Outbox: Cannot View standard Sender dictionary entries,Completed,3,,"6.0C, 6.07C, 6.08C, 6.1C, 6.13C, 6.14C, 6.15C",5,MIS.XI.SENDER.ee,6/19/2015,MIS 1783,5/15/2014,,Y,Y,,,,,,
,CS,MIS,16389,INFCE - CDA Organization-Level Cert should not be required with Sender Address,Completed,3,,"6.0C, 6.07C, 6.08C, 6.1C, 6.13C, 6.14C, 6.15C",4,MIS.XML.UTIL.ee.cda.configuration,6/19/2015,MIS 1705,2/20/2014,,Y,Y,,Y,,,,
,CS,MIS,16390,INFCE - ITI interfaces may send invalid attribute values,Completed,3,,"6.0C, 6.07C, 6.08C, 6.1C, 6.13C, 6.14C, 6.15C",4,"MIS.XIO.ehr.build.cda.data, MIS.XML.UTIL.build.object",6/19/2015,MIS 1701,2/20/2014,,Y,Y,,Y,,,,
,CS,MIS,16395,INFCE: 6.07 Immunizations Message Formatting Issues,Completed,3,,"6.0C, 6.07C, 6.08C, 6.1C, 6.13C, 6.14C, 6.15C",5,MIS.XIO.focus.immun.to.hl7,6/19/2015,MIS 1872,8/21/2014,,Y,Y,,,Y,,,
,CS,MIS,16399,Online Help Pharmacy Robot Wizard,Completed,3,Y,"6.0C, 6.07C, 6.08C, 6.1C, 6.13C, 6.14C",4,,6/19/2015,MIS 1691,,,Y,Y,,,,,,
,CS,MIS,16402,SYND - incorrect number populating subject,6.1-Completed,3,Y,"6.1C, 6.13C, 6.14C, 6.15C",,MIS.XIO.focus.reg.to.hl7.synd,6/19/2015,,5/15/2014,,,,,,Y,,,
,CS,MIS,16405,The Patient Authorities are not displayed on the MIS Vendor List report,6.1-Completed,3,,"6.0C, 6.08C, 6.1C, 6.13C, 6.14C, 6.15C",,,6/19/2015,,3/20/2014,,,,,,,,,
,CS,MIS,16435,DDP 18689: all AbsCode records from M-AT showing up as CPT-4 in discrete XML,6.1-Completed,3,,"6.1C, 6.13C, 6.14C, 6.15C",,MIS.XIO.ehr.build.cda.data,6/19/2015,,3/20/2014,,,,,Y,,,,
,CS,MIS,16437,CCD: Invalid units and results causes CCD to not validate,Completed,3,,"6.0C, 6.07C, 6.08C, 6.1C, 6.13C, 6.14C, 6.15C",4,"MIS.X.VALUE.SET.init.cda, MIS.X.VALUE.SET.init2.cda, MIS.XIO.ehr.build.cda.data, MIS.XML.UTIL.format.cda, MIS.XML.UTIL.iti.wizard",6/19/2015,MIS 1731,3/20/2014,,Y,Y,,Y,,,,
,CS,MIS,16457,INFCE: The eRx interface is not properly returning HTTP errors,Testing,3,,"6.0T, 6.07T, 6.08T, 6.1T, 6.13T, 6.14T, 6.15T",,MIS.EDI.xi.file.ncpdp.rx,6/19/2015,,6/18/2015,,,,,,,,,
,CS,MIS,16461,Online Help: Update to Mapping Dictionary Screen Shots,Completed,3,,"6.0C, 6.07C, 6.08C, 6.1C, 6.13C, 6.14C, 6.15C",4,,6/19/2015,MIS 1720,,,Y,Y,,,,,,
,CS,MIS,16479,Home Care patient query doesn't utilize the soundex search in 6.1,6.1-Completed,3,,"6.1C, 6.13C, 6.14C, 6.15C",,"MIS.XIO.hl7.dispatch.filers.insync, MIS.XIO.hl7.dispatch.filers.maestro",6/19/2015,,4/17/2014,,,,,,,,,
,CS,MIS,16507,INFCE: ITI-41 not generating Plan of Care,Completed,3,,"6.0C, 6.07C, 6.08C, 6.1C, 6.13C, 6.14C, 6.15C",5,MIS.XML.UTIL.xo.format.iti.41,6/19/2015,MIS 1884,7/17/2014,,Y,Y,,Y,,,,
,CS,MIS,16512,SYND: Need Ability to Send Occurrence Code 11 Date of Onset,Completed,3,,"6.0C, 6.07C, 6.08C",5,MIS.XIO.xo.format.get.all.appl.data,6/19/2015,MIS 1800,5/15/2014,,Y,Y,,,Y,,,
,CS,MIS,16532,SYND: County Code Missing if ZIP+4 Used,Completed,3,,"6.0C, 6.07C, 6.08C",5,MIS.XIO.xo.format.get.all.appl.data,6/19/2015,MIS 1801,4/17/2014,,Y,Y,,,Y,,,
,CS,MIS,16535,6.1 Home Care Patient Queries do not have a DSC segment in response message,6.1-Completed,3,,"6.1C, 6.13C, 6.14C, 6.15C",,MIS.XIO.xi.query.hl7.focus,6/19/2015,,4/17/2014,,,,,,,,,
,CS,MIS,16538,INFCE - MU screen parameter for Interface Type,Completed,3,,"6.0C, 6.07C, 6.08C, 6.1C, 6.13C, 6.14C, 6.15C",5,MIS.XO.MSG.GEN.ee.msg.medinet.res,6/19/2015,MIS 1802,5/15/2014,,Y,Y,,,Y,,,
,CS,MIS,16542,CCD: Encounter section missing Attending physician information,Completed,3,Y,"6.0C, 6.07C, 6.08C, 6.1C, 6.13C, 6.14C, 6.15C",5,MIS.XIO.ehr.build.cda.data,6/19/2015,MIS 1776,4/17/2014,,Y,Y,,Y,,,,
,CS,MIS,16545,INFCE: Delivery program needs to save Event Type of ITI-8 for ITI-9 message,Completed,3,,"6.0C, 6.07C, 6.08C, 6.1C, 6.13C, 6.14C, 6.15C",4,"MIS.X.DEL.TYPE.del.hl7mp, MIS.XML.PROTO.init",6/19/2015,MIS 1749,5/15/2014,,Y,Y,,Y,,,,
,CS,MIS,16548,INFCE: IMMUN hook changes for Namespace ID,Completed,3,Y,"6.0C, 6.07C, 6.08C, 6.1C, 6.13C, 6.14C, 6.15C",4,MIS.XIO.focus.immun.to.hl7,6/19/2015,MIS 1747,4/17/2014,,Y,Y,,,Y,,,
,CS,MIS,16550,CCD: Need to distinguish between XDS.b events versus DIRECT events,Completed,3,,"6.0C, 6.07C, 6.08C",4,"MIS.XI.MSG.delete, MIS.XML.UTIL.archive.cda, MIS.XML.UTIL.start.get.chart",6/19/2015,MIS 1732,4/17/2014,,Y,Y,,Y,,,,
,CS,MIS,16551,CCD: Need to distinguish between XDS.b events versus DIRECT events,6.1-Completed,3,,"6.1C, 6.13C, 6.14C, 6.15C",,"MIS.XI.MSG.delete, MIS.XI.MSG.index.reg.event.cda, MIS.XML.UTIL.archive.cda",6/19/2015,,3/19/2015,,,,,Y,,,,
,CS,MIS,16552,"CCD: Incorrectly logging ""SN"" on FAIL-SENT Messages for MU2 Reporting of TOC",Completed,3,,"6.0C, 6.07C, 6.08C, 6.1C, 6.13C, 6.14C, 6.15C",4,"MIS.X.DEL.TYPE.del.http, MIS.XML.UTIL.xi.file.iti.41",6/19/2015,MIS 1755,3/20/2014,,Y,Y,,Y,,,,
,CS,MIS,16554,INFCE - OBX|3.1.3 is nil for OBX's using nomenclature,Completed,3,,"6.0C, 6.07C, 6.08C, 6.1C, 6.13C, 6.14C, 6.15C",4,MIS.XIO.map,6/19/2015,MIS 1722,3/20/2014,,Y,Y,,,Y,,,
,CS,MIS,16564,SYND: PID|3 should include Acct Number,Completed,3,,"6.0C, 6.07C, 6.08C",5,MIS.XIO.xo.format.synd.surv.hl7,6/19/2015,MIS 1803,5/15/2014,,Y,Y,,,Y,,,
,CS,MIS,16580,CCDA: non-printable characters in text cause malformed XML,Completed,3,,"6.0C, 6.07C, 6.08C, 6.1C, 6.13C, 6.14C, 6.15C",4,"MIS.XIO.convert.to.other.value, MIS.XIO.pack.elements.xml, MIS.XML.UTIL.build.object, MIS.XML.UTIL.format.cda",6/19/2015,MIS 1748,4/17/2014,,Y,Y,,Y,,,,
,CS,MIS,16586,Second line of CCD Author Street address not appearing in .mtdd CCD reports,Completed,3,,"6.0C, 6.07C, 6.08C, 6.1C, 6.13C, 6.14C, 6.15C",4,MIS.X.OBJECT.init,6/19/2015,MIS 1736,3/20/2014,,Y,Y,,Y,,,,
,CS,MIS,16587,SYND - Add Arrival Date Time in PV1|44 for PRE ER patient,Completed,3,,"6.0C, 6.07C, 6.08C",5,"MIS.XIO.xo.format.get.all.appl.data, MIS.XIO.xo.format.synd.surv.hl7",6/19/2015,MIS 1804,5/15/2014,,Y,Y,,,Y,,,
,CS,MIS,16590,INFCE: Discharge Disposition not mapping in PV1|36,Completed,3,,"6.0C, 6.07C, 6.08C",5,MIS.XIO.xo.format.synd.surv.hl7,6/19/2015,MIS 1880,6/19/2014,,Y,Y,,,Y,,,
,CS,MIS,16593,INFCE - Provider Role not populating on CCD,Completed,3,,"6.0C, 6.07C, 6.08C, 6.1C, 6.13C, 6.14C, 6.15C",5,"MIS.X.QUERY.MAP.ee.query.mis, MIS.XIO.ehr.build.cda.data, MIS.XML.UTIL.format.cda, MIS.XML.UTIL.iti.wizard",6/19/2015,MIS 1777,4/17/2014,,Y,Y,,Y,,,,
,CS,MIS,16595,ITI-9 messages stuck in QUEUED because unable to find MRI database,Completed,3,,"6.0C, 6.07C, 6.08C, 6.1C, 6.13C, 6.14C, 6.15C",5,"MIS.X.DEL.TYPE.del.hl7mp, MIS.XML.UTIL.iti.wizard",6/19/2015,MIS 1931,6/19/2014,,Y,Y,,Y,,,,
,CS,MIS,16601,INFCE: SYND changes for Namespace ID to use Value Set,Completed,3,,"6.0C, 6.07C, 6.08C",,"MIS.XIO.build.syndromic.surveillance, MIS.XIO.xo.format.synd.surv.hl7, MIS.XO.MSG.GEN.ee.public.hlth.msg.parameters",6/19/2015,MIS 1960,8/21/2014,,Y,Y,,,Y,,,
,CS,MIS,16602,Message Generator changes to support Namespace Types in MSH segment,Completed,3,Y,"6.0C, 6.07C, 6.08C, 6.1C, 6.13C, 6.14C, 6.15C",5,"MIS.XO.MSG.GEN.ee, MIS.XO.MSG.GEN.ee.mpg.driver, MIS.XO.MSG.GEN.ee.mpg.driver.gen, MIS.XO.MSG.GEN.ee.mpg.driver.lab, MIS.XO.MSG.GEN.ee.mpg.driver.msh",6/19/2015,MIS 1805,4/17/2014,,Y,Y,,,,,,
,CS,MIS,16603,INFCE: SYND hook changes for Namespace ID,6.1-Completed,3,Y,"6.1C, 6.13C, 6.14C, 6.15C",,MIS.XIO.focus.reg.to.hl7.synd,6/19/2015,,5/15/2014,,,,,,Y,,,
,CS,MIS,16605,Add M-AT Inbox Connection Mnemonic param to the Inbound Msg Filer view routine,6.1-Completed,3,,"6.1C, 6.13C, 6.14C, 6.15C",,,6/19/2015,,5/15/2014,,,,,,,,,
,CS,MIS,16616,Message Filer dictionary alert not in view screen,Completed,3,,"6.0C, 6.07C, 6.08C, 6.1C, 6.13C, 6.14C, 6.15C",,,6/19/2015,MIS 2013,10/16/2014,,Y,Y,,,,,,
,CS,MIS,16622,Single quotes in XML attributes are causing infinite loops,Completed,3,,"6.0C, 6.07C, 6.08C, 6.1C, 6.13C, 6.14C, 6.15C",5,MIS.XML.UTIL.xml.extract.attributes,6/19/2015,MIS 1856,4/17/2014,,Y,Y,,Y,,,,
,CS,MIS,16628,Invalid Creation time in ITI-41 when using OIDS to find time,Completed,3,,"6.0C, 6.07C, 6.08C, 6.1C, 6.13C, 6.14C, 6.15C",5,"MIS.XML.UTIL.xo.format.iti.41, MIS.XML.UTIL.xo.format.smtp",6/19/2015,MIS 1828,5/15/2014,,Y,Y,,Y,,,,
,CS,MIS,16633,INFCE - Inbound messages can be skipped before they are finished filing,Submitted,3,,"6.07S, 6.13S",,,6/19/2015,,,,,,,,,,,
,CS,MIS,16650,INFCE: CCD - Rejecting PIX messages with CA acknowledgment code,Completed,3,,"6.0C, 6.07C, 6.08C, 6.1C, 6.13C, 6.14C, 6.15C",5,"MIS.XML.UTIL.xi.file.iti.44, MIS.XML.UTIL.xi.file.iti.45",6/19/2015,MIS 1885,8/21/2014,,Y,Y,,Y,,,,
,CS,MIS,16654,HTTP decode utility doesn't recognize/decode encoded HEX sequences,Completed,3,Y,"6.0C, 6.07C, 6.08C, 6.1C, 6.13C, 6.14C, 6.15C",5,MIS.XIO.convert.to.other.value,6/19/2015,MIS 1832,5/15/2014,,Y,Y,,Y,,,,
,CS,MIS,16658,CCDA: calls to HTTP encoding utility incur unnecessary performance costs,Completed,3,,"6.0C, 6.07C, 6.08C, 6.1C, 6.13C, 6.14C, 6.15C",,MIS.XML.UTIL.build.object,6/19/2015,MIS 2132,1/15/2015,,Y,Y,,Y,,,,
,CS,MIS,16669,LOINC codes not valid for transmission of MIC procedures in CDA,Completed,3,,"6.0C, 6.07C, 6.08C, 6.1C, 6.13C, 6.14C, 6.15C",5,MIS.XIO.ehr.build.cda.data,6/19/2015,MIS 1778,4/17/2014,,Y,Y,,Y,,,,
,CS,MIS,16674,INFCE - Discharge instruction queries do not appear on the CCD,Completed,3,Y,"6.0C, 6.07C, 6.08C, 6.1C, 6.13C, 6.14C, 6.15C",,"MIS.XIO.ehr.build.cda.data, MIS.XML.UTIL.format.cda",6/19/2015,MIS 1984,9/18/2014,,Y,Y,,Y,,,,"Formatting problems, see MIS 18088"
,CS,MIS,16709,CDA: Inbound Direct Filing issues,Completed,3,,"6.0C, 6.07C, 6.08C, 6.1C, 6.13C, 6.14C, 6.15C",5,"MIS.X.DEL.TYPE.http.synch.server, MIS.XML.UTIL.iti.wizard, MIS.XML.UTIL.mime.parse, MIS.XML.UTIL.xi.file.iti.41.direct",6/19/2015,MIS 1839,5/15/2014,,Y,Y,,Y,,,,
,CS,MIS,16710,CDA: ITI Wizard does not fully initialize profiles when loaded from Config Lib,Completed,3,,"6.0C, 6.07C, 6.08C, 6.1C, 6.13C, 6.14C, 6.15C",5,"MIS.XML.CONLIB.init.builder, MIS.XML.CONLIB.init.cda, MIS.XML.CONLIB.init.medallies.test, MIS.XML.PROFILE.ee",6/19/2015,MIS 1848,5/15/2014,,Y,Y,,Y,,,,
,CS,MIS,16712,INFCE: Pulling value set for MIC answer text to populate in OBX|5,Completed,3,,"6.0C, 6.07C, 6.08C, 6.1C, 6.13C, 6.14C, 6.15C",,"MIS.X.DICT.MAP.ee, MIS.X.DICT.MAP.id, MIS.X.DICT.MAP.load.dict.values, MIS.X.UNIT.ee, MIS.X.UNIT.init",6/19/2015,MIS 1953,8/21/2014,,Y,Y,,Y,,,,
,CS,MIS,16719,CCDA: displayName attribute not populating for Coded Entries (CE),Completed,3,,"6.0C, 6.07C, 6.08C, 6.1C, 6.13C, 6.14C, 6.15C",5,MIS.XML.UTIL.format.cda,6/19/2015,MIS 1812,5/15/2014,,Y,Y,,Y,,,,
,CS,MIS,16724,"INFCE: Populate OBX|6 with Age Units, OBX|5 Chief Complaint Fix",Completed,3,,"6.0C, 6.07C, 6.08C",5,MIS.XIO.xo.format.synd.surv.hl7,6/19/2015,MIS 1821,5/15/2014,,Y,Y,,,Y,,,
,CS,MIS,16725,INFCE: CCD assumes weight is in Kilograms,Completed,3,,"6.0C, 6.07C, 6.08C, 6.1C, 6.13C, 6.14C, 6.15C",5,"MIS.XIO.ehr.build.cda.data, MIS.XML.UTIL.format.cda",6/19/2015,MIS 1779,4/17/2014,,Y,Y,,Y,,,,
,CS,MIS,16728,"INFCE: CCD doesn't send ""true"" with no Immunizations",Completed,3,,"6.0C, 6.07C, 6.08C, 6.1C, 6.13C, 6.14C, 6.15C",5,MIS.XML.UTIL.format.cda,6/19/2015,MIS 1780,4/17/2014,,Y,Y,,Y,,,,
,CS,MIS,16729,INFCE: CCD doesn't send correct vital signs effective time,Completed,3,,"6.0C, 6.07C, 6.08C, 6.1C, 6.13C, 6.14C, 6.15C",5,MIS.XIO.ehr.build.cda.data,6/19/2015,MIS 1781,4/17/2014,,Y,Y,,Y,,,,
,CS,MIS,16731,"MM EDI messages failing for ""Unable to negotiate secure data connection""",Completed,3,,"6.0C, 6.07C, 6.08C, 6.1C, 6.13C, 6.14C, 6.15C",5,Z.ftp.functions,6/19/2015,MIS 1836,5/15/2014,,Y,Y,,,,,,
,CS,MIS,16739,INFCE: CCD File inbound XDR message incorrectly when document base64 encoded,Completed,3,,"6.0C, 6.07C, 6.08C, 6.1C, 6.13C, 6.14C, 6.15C",5,"MIS.X.DEL.TYPE.http.synch.server, MIS.XML.UTIL.xi.file.iti.41.direct",6/19/2015,MIS 1840,5/15/2014,,Y,Y,,Y,,,,
,CS,MIS,16741,Inactive MRI DB can be used when trying to create a GXOQ event for ITI txns,Completed,3,,"6.0C, 6.07C, 6.08C, 6.1C, 6.13C, 6.14C, 6.15C",5,"MIS.XIO.ehr.supplier.dispatch, MIS.XIO.queue.iti.events, MIS.XML.UTIL.get.cda.for.view, MIS.XML.UTIL.get.cda.for.view.mobile, MIS.XML.UTIL.get.cda.for.view.npr, MIS.XML.UTIL.get.current.cda, MIS.XML.UTIL.id.patient, MIS.XML.UTIL.queue.direct.email, MIS.XML.UTIL.test.format.cda, MIS.XML.UTIL.test.view.cda.archive, MIS.XML.UTIL.xi.file.iti.45",6/19/2015,MIS 1886,8/21/2014,,Y,Y,,Y,,,,
,CS,MIS,16743,Digitally Signed Data Causing Crash (MG NMI DTS 1600),6.1-Submitted,3,,"6.0S, 6.08S, 6.1S, 6.15S",,,6/19/2015,,,,,,,,,,,
,CS,MIS,16748,CDA: High volume can cause CCD generation backlogs,Completed,3,Y,"6.0C, 6.07C, 6.08C, 6.1C, 6.13C, 6.14C, 6.15C",5,"MIS.X.DEL.SVC.file.msg.inbox, MIS.X.DEL.TYPE.from.folder.to.appl.anp, MIS.XIO.master.instance, MIS.XIO.queue.iti.events, MIS.XML.UTIL.ee.cda.configuration.multi, MIS.XML.UTIL.ee.cda.configuration.params",6/19/2015,MIS 1841,5/15/2014,,Y,Y,,Y,,,,
,CS,MIS,16749,"INFCE: CCD sends ""UNK"" problem effective time",Completed,3,,"6.0C, 6.07C, 6.08C, 6.1C, 6.13C, 6.14C, 6.15C",5,MIS.XML.UTIL.format.cda,6/19/2015,MIS 1813,5/15/2014,,Y,Y,,Y,,,,
,CS,MIS,16754,Add new base64 decoder to Interface Manager,Completed,3,,"6.0C, 6.07C, 6.08C, 6.1C, 6.13C, 6.14C, 6.15C",,"MIS.XIO.im.msg.view, MIS.XIO.im.scr.txt",6/19/2015,MIS 2017,10/16/2014,,Y,Y,,Y,,,,
,CS,MIS,16757,INFCE: CCD entity name is not sending for service delivery location,Completed,3,,"6.0C, 6.07C, 6.08C, 6.1C, 6.13C, 6.14C, 6.15C",5,MIS.XML.UTIL.format.cda,6/19/2015,MIS 1814,5/15/2014,,Y,Y,,Y,,,,
,CS,MIS,16762,INFCE: Event OID from EMR can be invalid,Completed,3,,"6.0C, 6.07C, 6.08C, 6.1C, 6.13C, 6.14C, 6.15C",5,MIS.XML.UTIL.format.cda,6/19/2015,MIS 1815,4/17/2014,,Y,Y,,Y,,,,
,CS,MIS,16766,INFCE: ITI-44 does not convert enc chars in street address,Completed,3,Y,"6.0C, 6.07C, 6.08C, 6.1C, 6.13C, 6.14C, 6.15C",5,MIS.XML.UTIL.xo.format.iti.44,6/19/2015,MIS 1784,4/17/2014,,Y,Y,,Y,,,,
,CS,MIS,16767,INFCE:CCD not validating because of invalid results and/or vital signs.,Completed,3,,"6.0C, 6.07C, 6.08C, 6.1C, 6.13C, 6.14C, 6.15C",5,"MIS.XML.PROTO.init, MIS.XML.UTIL.format.cda",6/19/2015,MIS 1816,4/17/2014,,Y,Y,,Y,,,,
,CS,MIS,16776,INFCE: The code description length can cause the value set map to crash,Completed,3,,"6.0C, 6.07C, 6.08C, 6.1C, 6.13C, 6.14C, 6.15C",,"MIS.X.VALUE.SET.ee, MIS.X.VALUE.SET.ee2",6/19/2015,MIS 1969,9/18/2014,,Y,Y,,Y,,,,
,CS,MIS,16782,Typo in CCD Wizard; assigns RVC/SND as Direction in XDR Del SVC,Completed,3,,"6.0C, 6.07C, 6.08C, 6.1C, 6.13C, 6.14C, 6.15C",5,MIS.XML.UTIL.iti.wizard,6/19/2015,MIS 1932,6/19/2014,,Y,Y,,Y,,,,
,CS,MIS,16783,"INFCE: CCD Portal documents have ""Refferal"" not ""Referral"" in Encounter Tab",Completed,3,,"6.0C, 6.07C, 6.08C, 6.1C, 6.13C, 6.14C, 6.15C",5,MIS.XIO.ehr.build.cda.data,6/19/2015,MIS 1791,4/17/2014,,Y,Y,,Y,,,,
,CS,MIS,16788,INFCE: Web Service SOAP response doesn't HTTP encode <relatesTo> value,Completed,3,,"6.0C, 6.07C, 6.08C, 6.1C, 6.13C, 6.14C, 6.15C",5,"MIS.XML.UTIL.format.soap.12, MIS.XML.UTIL.format.soap.12.response",6/19/2015,MIS 1927,7/17/2014,,Y,Y,,Y,,,,
,CS,MIS,16792,Add negation indicator for all CDA sections,Completed,3,Y,"6.0C, 6.07C, 6.08C, 6.1C, 6.13C, 6.14C, 6.15C",,"MIS.XML.PROTO.init, MIS.XML.UTIL.format.cancer.cda, MIS.XML.UTIL.format.cda",6/19/2015,MIS 2023,10/16/2014,,Y,Y,,Y,,,,
,CS,MIS,16811,Change Relationship to Role for the Support Section of the CCDA,Completed,3,,"6.0C, 6.07C, 6.08C, 6.1C, 6.13C, 6.14C, 6.15C",5,"MIS.XIO.install.cda.style.sheet, MIS.XIO.install.cda.style.sheet.inline",6/19/2015,MIS 1851,6/19/2014,,Y,Y,,Y,,,,
,CS,MIS,16819,Delivery Service Trap: Screen corruption when viewing trap,6.1-Submitted,3,,"6.0S, 6.08S, 6.1S",,,6/19/2015,,,,,,,,,,,
,CS,MIS,16826,NMI: Potential Security Threat with CCDA Style-sheets (6.x),Completed,2,,"6.0C, 6.07C, 6.08C, 6.1C, 6.13C, 6.14C, 6.15C",5,"MIS.XIO.install.cda.style.sheet, MIS.XIO.install.cda.style.sheet.inline",6/19/2015,MIS 1809,4/30/2014,,Y,Y,,Y,,,,
,CS,MIS,16840,ITI.41 Interface Retrieving SOAP GUID from Wrong Element,Completed,3,,"6.0C, 6.07C, 6.08C, 6.1C, 6.13C, 6.14C, 6.15C",5,"MIS.X.DEL.TYPE.del.http, MIS.XML.UTIL.mime.parse, MIS.XML.UTIL.soap.parse, MIS.XML.UTIL.xi.file.iti.41",6/19/2015,MIS 1855,6/19/2014,,Y,Y,,Y,,,,
,CS,MIS,16845,SYND: Value set for Mode of Arrival in PV2-38,Completed,3,Y,"6.0C, 6.07C, 6.08C, 6.1C, 6.13C, 6.14C, 6.15C",5,"MIS.X.CODE.SYS.init2, MIS.X.DICT.MAP.ee, MIS.X.VALUE.SET.init.phvs, MIS.X.VALUE.SET.init2.phvs, MIS.XIO.xo.format.get.all.appl.data, MIS.XIO.xo.format.synd.surv.hl7",6/19/2015,MIS 1881,6/19/2014,,Y,Y,,Y,,,,
,CS,MIS,16846,"CCDA: certain non-printable chars should be changed to blanks, not encoded",Completed,3,,"6.0C, 6.07C, 6.08C, 6.1C, 6.13C, 6.14C, 6.15C",5,MIS.XIO.convert.to.other.value,6/19/2015,MIS 1833,5/15/2014,,Y,Y,,Y,,,,
,CS,MIS,16853,INFCE: Memory Leak / Performance Issues for ERX driver and TCPIP.SSL code,Completed,3,,"6.0C, 6.07C, 6.08C, 6.1C, 6.13C, 6.14C, 6.15C",5,"MIS.X.DEL.SVC.driver.rx, MIS.X.DEL.TYPE.tcpip.synch.ssl",6/19/2015,MIS 1842,6/19/2014,,Y,Y,,,,,,
,CS,MIS,16867,INFCE: Add Facility Section to Inbound Results Filer,Submitted,3,,"6.0S, 6.07S, 6.08S, 6.1S, 6.13S",,,6/19/2015,,,,,,,,,,,
,CS,MIS,16874,Additional fields for Syndromic Surveillance Interface,Completed,3,Y,"6.0C, 6.07C, 6.08C",5,"MIS.XIO.build.syndromic.surveillance, MIS.XIO.xo.format.get.all.appl.data, MIS.XIO.xo.format.synd.surv.hl7, MIS.XO.MSG.GEN.ee.public.hlth.msg.parameters",6/19/2015,MIS 1822,6/19/2014,,Y,Y,,,Y,,,
,CS,MIS,16882,Standard Objects are not being copied to Custom objects from the Profile E/E,Completed,3,,"6.0C, 6.07C, 6.08C, 6.1C, 6.13C, 6.14C, 6.15C",5,MIS.XML.PROFILE.ee,6/19/2015,MIS 1849,6/19/2014,,Y,Y,,Y,,,,
