C/R,Product,Application,DTS #,Description,Status (6.07),Pri,Ass'd DTSs,Releases,PP ,Programs,Date Checked,6.07 Chg #,Due Date,To Be Shipped (6.07),Shipping Test,Shipping Live,LSS,CCD,MU2,Resp App,Dev OK'd,Comments
,CS,ABS,3741,INFCE: Populate Group Text and Coding System Name in DRG|1.1.2 and DRG|1.1.3,Completed,3,,"6.0C, 6.07C, 6.08C",5,ABS.PAT.xo.format.hl7.comp,6/19/2015,ABS 545,1/7/2014,,Y,Y,,,,,,
,CS,ADM,7255,INFCE: MIGRATE_IC Filer does not File Consulting Providers into ADM,Completed,3,,"6.0C, 6.07C, 6.08C",4,ADM.PAT.xi.file.hl7.comp.ini.load,6/19/2015,ADM 938,2/17/2012,,Y,Y,,,,,,
R,CS,ADM,7426,INFCE: Health Care Number doesn't file from PID|3,Completed,3,,"6.0C, 6.06C, 6.07C, 6.08C, 6.1C, 6.13C, 6.14C",4,"ADM.PAT.xi.file.hl7.comp.him.visit, ADM.PAT.xi.file.hl7.comp.ini.load",6/19/2015,ADM 939,5/21/2012,,Y,Y,,,,,,Req'd for Canadian sites
R,CS,ADM,7453,INFCE: Migration Interfaces not filing IN1|14 - Insurance Auth # to right ddef,Completed,3,,"6.0C, 6.07C, 6.08C",5,"ADM.PAT.xi.file.hl7.comp.him.visit, ADM.PAT.xi.file.hl7.comp.ini.load",6/19/2015,ADM 1061,6/19/2014,,Y,Y,,,,,,
,CS,ADM,7664,EVN.2 May Contain Invalid Data For Certain Event Types,Completed,3,,"6.0C, 6.07C, 6.08C",,"ADM.PAT.xo.format.hl7.comp, ADM.PAT.xo.format.hl722",6/19/2015,ADM 1117,,,Y,Y,,,,,,
,CS,ADM,7755,"INFCE: Migration: PTN, NOK, GT1 names need to be sent in 1 comp to HIM",Completed,3,Y,"6.0C, 6.07C, 6.08C, 6.1C, 6.13C, 6.14C",4,ADM.PAT.xi.file.hl7.comp.him.visit,6/19/2015,ADM 940,12/10/2012,,Y,Y,,,,,,
,CS,ADM,7985,INFCE: Fields in MPI getting overwritten by Homecare messages,Draft,3,,"6.0D, 6.07D, 6.08D",,"ADM.PAT.xi.file.hl7.insync, ADM.PAT.xi.file.hl7.maestro",6/19/2015,,7/16/2015,,,,,,,,,
,CS,ADM,8019,"INFCE: Fix ROL Segment Always Sending ""AD"" in ROL|2.1.1",Submitted,3,,"6.05S, 6.06S, 6.07S",,,6/19/2015,,,,,,,,,,,
,CS,ADM,8052,INFCE - SSN is not sent in ITI-8 messages for HL7 version 2.4,Completed,3,,"6.0C, 6.07C, 6.08C",4,ADM.PAT.xo.format.hl7.iti.8,6/19/2015,ADM 976,1/17/2014,,Y,Y,,Y,,,,
,CS,ADM,8117,Maiden name flag is not sent to HIM for MIGRATE_HV interface,Completed,3,Y,"6.0C, 6.07C, 6.08C, 6.1C, 6.13C, 6.14C",4,ADM.PAT.xi.file.hl7.comp.him.visit,6/19/2015,ADM 941,7/27/2013,,Y,Y,,,,,,
,CS,ADM,8157,INFCE: 6.x will file an incorrect unit/acct number if MAGIC does not send one,Completed,3,,"6.0C, 6.07C, 6.08C",4,"ADM.PAT.xi.file.hl7.comp.him.visit, ADM.PAT.xi.file.hl7.comp.ini.load",6/19/2015,ADM 942,8/11/2013,,Y,Y,,,,,,
,CS,ADM,8183,INFCE: Some Sign Up Dr's do not generate messages,Completed,3,Y,"6.0C, 6.07C, 6.08C",4,"ADM.PARAM.load.event.table, ADM.PAT.xo.format.hl7.comp, ADM.PAT.xo.format.hl7.insync, ADM.PAT.xo.format.hl7.maestro, ADM.STATUS.init.routines",6/19/2015,ADM 953,8/19/2013,,Y,Y,,,,,,
,CS,ADM,8248,INFCE: ADT Inbound Demo Recall Messages File to ADM but not HIM,Completed,3,,"6.0C, 6.07C, 6.08C",4,ADM.PAT.xi.file.hl7.comp,6/19/2015,ADM 969,2/20/2014,,Y,Y,,,,,,
,CS,ADM,8249,INFCE: Time sent with Birthdate causes blank field in ADM and Incorrect Age,Completed,3,,"6.0C, 6.07C, 6.08C",4,ADM.PAT.xi.file.hl7.comp,6/19/2015,ADM 970,9/30/2013,,Y,Y,,,,,,
,CS,ADM,8310,INFCE - ITI-8 root OID does not match ITI-41 root OID,Completed,3,,"6.0C, 6.07C, 6.08C",4,ADM.PAT.xo.format.hl7.iti.8,6/19/2015,ADM 977,2/20/2014,,Y,Y,,Y,,,,
,CS,ADM,8331,Wrong patient name sent on switch/Move acct A44 trigger event,Completed,3,,"6.0C, 6.07C, 6.08C",4,ADM.PAT.xo.format.hl7.comp,6/19/2015,ADM 916,12/8/2013,,Y,Y,,,,,,
,CS,ADM,8338,A03 can be sent incorrectly for roll over account,Completed,3,,"6.0C, 6.07C, 6.08C",4,ADM.PAT.xo.format.hl7.comp,6/19/2015,ADM 957,2/20/2014,,Y,Y,,,,,,
,CS,ADM,8374,INFCE: Inbound ADT FAIL-READs for name mismatch even after ADM 7990,Completed,3,Y,"6.0C, 6.07C, 6.08C",4,ADM.PAT.xi.file.hl7.comp,6/19/2015,ADM 971,1/3/2014,,Y,Y,,,,,,
,CS,ADM,8432,RESUB ADM 6326 Read in religion from PID|17 for ADT inbound interface,Completed,3,,6.07C,4,ADM.PAT.xi.file.hl7.comp,6/19/2015,ADM 972,1/16/2014,,Y,Y,,,,,,
,CS,ADM,8517,INFCE: DG1 segment - dual coding,Completed,3,,"6.0C, 6.07C, 6.08C",5,ADM.PAT.xo.format.hl7.comp,6/19/2015,ADM 1000,5/15/2014,,Y,Y,,,,,,
,CS,ADM,8539,INFCE: ITI-8 not producing an ITI-9 event for A01's and A04's as it should,Completed,3,,"6.0C, 6.07C, 6.08C, 6.1C, 6.13C, 6.14C, 6.15C",4,ADM.PAT.xi.file.hl7.iti.8,6/19/2015,ADM 987,5/15/2014,,Y,Y,,Y,,,,
R,CS,ADM,8619,INFCE - Memory leak in outbound ADT interfaces,Completed,3,,"6.0C, 6.07C, 6.08C",5,ADM.PAT.xo.format.hl7.comp,6/19/2015,ADM 1016,4/17/2014,,Y,Y,,,,,,
,CS,ADM,8624,INFCE - SSN is not sent in PID|19 in ITI-8 messages for HL7 v2.4 and above,Completed,3,,"6.0C, 6.07C, 6.08C",5,ADM.PAT.xo.format.hl7.iti.8,6/19/2015,ADM 1017,5/15/2014,,Y,Y,,Y,,,,
,CS,ADM,8632,"SYND: Adding Hook point ""Arrival.Pv2.38""",Completed,3,,"6.0C, 6.07C, 6.08C",5,ADM.TOOL.BOX.init.x.msg.type,6/19/2015,ADM 1042,6/19/2014,,Y,Y,,,Y,,,
,CS,ADM,8643,Additional fields for Syndromic Surveillance Interface,Completed,3,,"6.0C, 6.07C, 6.08C",5,ADM.TOOL.BOX.init.x.msg.type,6/19/2015,ADM 1025,6/19/2014,,Y,Y,,,Y,,,
,CS,ADM,8714,Always populate EVN|1 with Event Code,Completed,3,,"6.0C, 6.07C, 6.08C, 6.1C, 6.14C, 6.15C",,ADM.PAT.xo.format.hl7.comp,6/19/2015,ADM 1198,3/19/2015,,Y,Y,,,,,,
,CS,ADM,8720,INFCE: ADT Outbound sending blank name components in PID|5 and PID|9,Completed,3,,"6.0C, 6.07C, 6.08C",,ADM.PAT.xo.format.hl7.comp,6/19/2015,ADM 1119,10/16/2014,,Y,Y,,,,,,
,CS,ADM,8782,INFCE: Patient's Other Locations & Email Address Removed -ADT Inbound,Completed,3,,"6.0C, 6.07C, 6.08C",,ADM.PAT.xi.file.hl7.comp,6/19/2015,ADM 1202,4/16/2015,,Y,Y,,,,,,
,CS,ADM,8783,CDA: Rework of Opt Out Query and Patient Confidential flag,Completed,3,Y,"6.0C, 6.07C, 6.08C",,,6/19/2015,ADM 1103,9/18/2014,,Y,Y,,Y,,,,
,CS,ADM,8950,"Infce: Add ability to record ""footprints""",Completed,3,Y,"6.0C, 6.07C, 6.08C",,ADM.PAT.xo.driver,6/19/2015,ADM 1158,1/15/2015,,Y,Y,,,,,,
,CS,ADM,8977,Modify formatting of PIDUniversal ID on ITI-8,Completed,3,Y,"6.0C, 6.07C, 6.08C",,ADM.PAT.xo.format.hl7.iti.8,6/19/2015,ADM 1160,3/19/2015,,Y,Y,,Y,,,,
,CS,ADM,8989,INFCE: Inbound A04's from HomeCare are failing for MRI Conflict,Submitted,3,,6.07S,,,6/19/2015,,,,,,,,,,,
,CS,ADM,9015,IHIE ITI: OID & Patient Identifer Vendor Flexibility (ITI-8),Submitted,3,,"6.0S, 6.07S, 6.08S",,,6/19/2015,,,,,,,Y,,,,
,CS,ADM,9020,INFCE - Inbound ADT cannot file any query via OBX segments,Submitted,3,,6.07S,,,6/19/2015,,,,,,,,,,,
,CS,ADM,9049,INFCE: Memory Leak in ADT Outbound Interface,Completed,3,,"6.0C, 6.07C, 6.08C",,ADM.PAT.xo.format.hl7.comp,6/19/2015,ADM 1234,6/18/2015,Y,,,,,,,,
,CS,ADM,9051,INFCE: Syndromic Message Generator needs Multipage driver on child screen,Completed,3,Y,"6.0C, 6.07C, 6.08C",,ADM.TOOL.BOX.init.x.msg.type,6/19/2015,ADM 1229,6/18/2015,Y,,,,,,,,
,CS,ADM,9057,INFCE: ROL Segment should be send out regardless of HL7 Version,Submitted,3,,"6.0S, 6.07S, 6.08S",,,6/19/2015,,,,,,,,,,,
,CS,ADM,9068,INFCE: Homecare HC-ADM fails to generate A08 message,Submitted,3,,6.07S,,,6/19/2015,,,,,,,,,,,
,CS,LAB,8570,DDP 11346: LIS: Magic 5.6 to C/S 6.0 Dictionary Migration (High Priority DPMs),6.1-Completed,4,Y,"6.0C, 6.04C, 6.05C, 6.06C, 6.1C, 6.11C, 6.13C",,,6/19/2015,,,,,,,,,,,
,CS,LAB,9359,INFCE: Invalid facility filtering creates blank order messages,Completed,3,,"6.0C, 6.07C, 6.08C, 6.1C, 6.13C, 6.14C, 6.15C",5,LAB.C.REQ.xo.format.ord.hl7.comp,6/19/2015,LAB 1655,,,Y,Y,,,,,,
,CS,LAB,9751,MIC Antibiotic Sensitivities May Not File in COMP Code,Submitted,3,,"6.0S, 6.07S, 6.08S",,,6/19/2015,,,,,,,,,,,
,CS,LAB,9843,"BBK: BBK Result populating in OBX|5.1.2, should be in OBX|5.1.1",Completed,3,,"6.0C, 6.07C, 6.08C, 6.1C, 6.13C, 6.14C",4,"LAB.C.SPEC.xo.format.hl7.discres.comp, LAB.C.SPEC.xo.format.hl7.discres.nomen",6/19/2015,LAB 1458,5/10/2011,,Y,Y,,,Y,,,
,CS,LAB,10097,INFCE: POC Results In - Invalid Doctor Mnemonic Error,Completed,3,,"6.0C, 6.07C, 6.08C, 6.1C, 6.13C, 6.14C",4,LAB.C.REQ.xi.file.ord.hl7.comp,6/19/2015,LAB 1435,8/15/2011,,Y,Y,,,,,,
,CS,LAB,10169,INFCE: NTE Counter not reseting after OBR/OBX segment,Submitted,3,,"6.0S, 6.07S, 6.08S, 6.1S, 6.13S, 6.14S, 6.15S",,,6/19/2015,,,,,,,,,,,
,CS,LAB,10467,INFCE: LAB Outbound name formats incorrectly in PID Segment,Completed,3,,"6.0C, 6.07C, 6.08C, 6.1C, 6.13C, 6.14C",4,LAB.C.SPEC.xo.format.res.hl7.comp,6/19/2015,LAB 1460,2/7/2012,,Y,Y,,,,,,
,CS,LAB,10550,INFCE: MIC NP-ed Multiple Results Sending OBR Segments,Completed,3,,"6.0C, 6.07C, 6.08C, 6.1C, 6.13C, 6.14C",4,"LAB.C.SPEC.xo.format.hl7.discres.comp, LAB.C.SPEC.xo.format.hl7.discres.nomen, LAB.C.SPEC.xo.format.res.hl7.comp",6/19/2015,LAB 1461,3/10/2012,,Y,Y,,,Y,,,
R,CS,LAB,10902,INFCE: Discrete Results missing sensis for all procs and site info in OBX,Completed,3,,"6.0C, 6.07C, 6.08C, 6.1C, 6.13C, 6.14C",4,"LAB.C.SPEC.xo.format.hl7.discres.comp, LAB.C.SPEC.xo.format.hl7.discres.nomen",6/19/2015,LAB 1464,7/2/2012,,Y,Y,,,Y,,,
,CS,LAB,10937,NETLAB:Addon Orders with Lord Lab Link Rule Fail-Read,Completed,3,,"6.0C, 6.07C, 6.08C, 6.1C, 6.13C, 6.14C, 6.15C",5,LAB.C.REQ.xi.ord.filer.add,6/19/2015,LAB 1627,5/15/2014,,Y,Y,,,,,,
,CS,LAB,10966,INFCE: All orders are not being sent in batch for LAB Orders Out,Completed,3,,"6.0C, 6.07C, 6.08C, 6.1C, 6.13C, 6.14C, 6.15C",,LAB.C.REQ.xo.driver.ord,6/19/2015,LAB 1777,7/29/2012,,Y,Y,,,,,,
,CS,LAB,10990,INFCE: OV Lab Inbound Order OM Messages Fail-Read for Unrecognized Priority,Submitted,3,,"6.0S, 6.05S, 6.06S, 6.07S, 6.08S, 6.1S, 6.13S, 6.14S, 6.15S",,,6/19/2015,,,,,,,,,,,
C,CS,LAB,11013,INFCE: Memory leak in POC Results inbound interface,6.1-Completed,3,,"6.0C, 6.06C, 6.08C, 6.1C, 6.13C, 6.14C",,LAB.C.SPEC.xi.file.res.hl7.comp,6/19/2015,,8/4/2012,,,,,,,,,
,CS,LAB,11200,INFCE - Inbound LAB orders error logging can cause errors in DR,Completed,3,,"6.0C, 6.07C, 6.08C, 6.1C, 6.13C, 6.14C, 6.15C",4,LAB.C.REQ.xi.ord.filer,6/19/2015,LAB 1518,10/26/2012,,Y,Y,,,,,,
,CS,LAB,11265,LAB/MIC: Weight Queries do not Convert Properly from Dict. to OBX Segment,Completed,3,Y,"6.0C, 6.07C, 6.08C, 6.1C, 6.13C, 6.14C, 6.15C",4,LAB.C.REQ.xo.format.ord.hl7.comp,6/19/2015,LAB 1525,12/1/2012,,Y,Y,,,,,,
,CS,LAB,11419,Custom Reg Types Not Working Correctly with HL7 Messages,6.1-Completed,3,Y,"6.1C, 6.13C, 6.14C",,"LAB.C.SPEC.xo.format.hl7.discres.mpm, LAB.C.SPEC.xo.format.hl7.discres.nomen",6/19/2015,,1/14/2013,,,,Y,,Y,,,
,CS,LAB,11537,INFCE - Multiple tests filed in one message can have their priorities changed,Submitted,3,,"6.0S, 6.05S, 6.06S, 6.07S, 6.08S, 6.1S, 6.14S, 6.15S",,,6/19/2015,,,,,,,,,,,
,CS,LAB,11599,"INFCE: when creating a new patient, name should be uppercase",Completed,3,,"6.0C, 6.07C, 6.08C, 6.1C, 6.13C, 6.14C",4,LAB.C.REQ.xi.file.ord.hl7.comp,6/19/2015,LAB 1436,5/4/2013,,Y,Y,,,,,,
,CS,LAB,11643,"INFCE: if PID|3 of inbound OM orders is too short, pad with 0s",Submitted,3,,"6.05S, 6.06S, 6.07S",,,6/19/2015,,,,,,,,,,,
,CS,LAB,11647,DDP 17117: Formatter changes needed for 6.1 NIST Stage 2 Certification,6.1-Completed,3,Y,"6.1C, 6.13C, 6.14C",,"LAB.C.SPEC.xo.format.hl7.discres.nomen, LAB.TOOL.BOX.init.x.msg.type",6/19/2015,,6/9/2013,,,,,,Y,,,
R,CS,LAB,11663,INFCE: Inbound OM interface crashes if message has nil OBX|5,6.1-Completed,3,,"6.1C, 6.13C, 6.14C, 6.15C",,LAB.C.REQ.xo.format.hl7.focus,6/19/2015,,5/28/2013,,,,,,,,,
,CS,LAB,11716,INFCE: Prompt Result Abnormal Flags not sent in OBX|8 for MIC,Completed,3,,"6.0C, 6.07C, 6.08C, 6.1C, 6.13C, 6.14C",4,LAB.C.SPEC.xo.format.res.hl7.comp,6/19/2015,LAB 1466,6/25/2013,,Y,Y,,,,,,
R,CS,LAB,11730,INFCE: Patient sex should not be required on POC.,Completed,3,,"6.0C, 6.07C, 6.08C, 6.1C, 6.13C, 6.14C",4,"LAB.C.REQ.xi.file.ord.hl7.comp, LAB.C.REQ.xi.file.ord.hl723",6/19/2015,LAB 1437,8/26/2013,,Y,Y,,,,,,
,CS,LAB,11741,LIS: OV ITS orders send the Specimen field on the Order,,3,,6.06S,,,6/19/2015,,,,,,,,,,,
,CS,LAB,11831,INFCE: Spec Number not added to subject line if message FAIL-READs,Completed,3,,"6.0C, 6.07C, 6.08C, 6.1C, 6.13C, 6.14C, 6.15C",5,"LAB.C.SPEC.xi.file.res.hl7.comp, LAB.C.SPEC.xi.file.res.hl7.nomen, LAB.L.SPEC.xi.file.res.hl7.comp, LAB.L.SPEC.xi.file.res.hl7.nomen, LAB.M.SPEC.xi.file.res.hl7.comp, LAB.M.SPEC.xi.file.res.hl7.nomen",6/19/2015,LAB 1576,8/24/2013,,Y,Y,,,,,,
,CS,LAB,11833,INFCE: Send LAB Site in OBX|15 for BBK Products,Completed,3,,"6.0C, 6.07C, 6.08C, 6.1C, 6.13C, 6.14C",4,"LAB.C.SPEC.xo.format.hl7.discres.comp, LAB.C.SPEC.xo.format.hl7.discres.mpm, LAB.C.SPEC.xo.format.hl7.discres.nomen",6/19/2015,LAB 1467,8/24/2013,,Y,Y,,,Y,,,
,CS,LAB,11836,DDP 17919: Certification Updates for LAB/MIC Inbound Results Filer,Completed,4,,"6.0C, 6.07C, 6.08C, 6.1C, 6.13C, 6.14C, 6.15C",4,"LAB.C.SPEC.xi.file.res.hl7.nomen, LAB.C.SPEC.xi.results, LAB.L.SPEC.xi.file.res.hl7.nomen, LAB.M.SPEC.xi.file.res.hl7.nomen",6/19/2015,LAB 1571,,,Y,Y,,,Y,,,
,CS,LAB,11860,"INFCE: Corrected LAB Group Tests Not Sending ""C"" in OBR|25",Completed,3,,"6.0C, 6.07C, 6.08C, 6.1C, 6.13C, 6.14C",4,"LAB.C.SPEC.xo.format.hl7.discres.comp, LAB.C.SPEC.xo.format.hl7.discres.nomen",6/19/2015,LAB 1468,10/7/2013,,Y,Y,,,Y,,,
,CS,LAB,11863,OV ID information is not populating OBR|2 on results outbound for deleted ords,6.1-Completed,3,Y,"6.1C, 6.13C, 6.14C",,"LAB.C.SPEC.xo.format.hl7.discres.comp, LAB.C.SPEC.xo.format.hl7.discres.nomen",6/19/2015,,8/30/2013,,,,,,Y,,,
,CS,LAB,11898,NMI: Update LAB Message Type Hookpoints to Reference New Value Sets,Completed,3,Y,"6.0C, 6.07C, 6.08C, 6.1C, 6.13C, 6.14C",4,LAB.TOOL.BOX.init.x.msg.type,6/19/2015,LAB 1439,9/15/2013,,Y,Y,,,,,,
,CS,LAB,11930,"INFCE:  NOK Employee Status Posting to NK1|32, Should Post to NK1|34",Completed,3,,"6.0C, 6.07C, 6.08C, 6.1C, 6.13C, 6.14C",4,"LAB.C.SPEC.xo.format.hl7.discres.comp, LAB.C.SPEC.xo.format.hl7.discres.mpm",6/19/2015,LAB 1469,10/4/2013,,Y,Y,,,,,,
,CS,LAB,11932,"INFCE: ""CHG"" orders will not generate an OBR segment(s)",Completed,3,Y,"6.0C, 6.07C, 6.08C, 6.1C, 6.13C, 6.14C, 6.15C",4,LAB.C.REQ.xo.format.ord.hl7.comp,6/19/2015,LAB 1527,10/4/2013,,Y,Y,,,,,,
,CS,LAB,11963,INFCE - Public Health LMBP Diagnostic Serv Sect ID issues,Completed,3,,"6.0C, 6.07C, 6.08C, 6.1C, 6.13C, 6.14C",4,"LAB.C.SPEC.xo.format.hl7.discres.comp, LAB.C.SPEC.xo.format.hl7.discres.nomen",6/19/2015,LAB 1470,10/15/2013,,Y,Y,,,Y,,,
,CS,LAB,11964,INFCE - Public Health LMBP not sending all MIC prompt results,Completed,3,,"6.0C, 6.07C, 6.08C, 6.1C, 6.13C, 6.14C, 6.15C",5,"LAB.C.SPEC.xo.format.hl7.discres.comp, LAB.C.SPEC.xo.format.hl7.discres.nomen",6/19/2015,LAB 1583,4/17/2014,,Y,Y,,,Y,,,
,CS,LAB,11972,INFCE - Public Health LMBP is not sending LAB Test Result Group,Completed,3,,"6.0C, 6.07C, 6.08C, 6.1C, 6.13C, 6.14C",4,LAB.C.SPEC.xo.format.hl7.discres.nomen,6/19/2015,LAB 1504,1/16/2014,,Y,Y,,,Y,,,
,CS,LAB,11980,INFCE - Public Health LMBP not sending special result text,Completed,3,,"6.0C, 6.07C, 6.08C, 6.1C, 6.13C, 6.14C",4,LAB.C.SPEC.xo.format.hl7.discres.nomen,6/19/2015,LAB 1471,10/27/2013,,Y,Y,,,Y,,,
,CS,LAB,11981,INFCE - Public Health LMBP sending incorrect specimen priority,Completed,3,,"6.0C, 6.07C, 6.08C, 6.1C, 6.13C, 6.14C",4,LAB.C.SPEC.xo.format.hl7.discres.nomen,6/19/2015,LAB 1472,10/27/2013,,Y,Y,,,Y,,,
C,CS,LAB,11996,INFCE: DTS LAB 11692 Introduces Code That Blocks Sending All Pathology Results,Completed,3,,"6.0C, 6.07C, 6.08C, 6.1C, 6.13C, 6.14C",4,LAB.C.SPEC.xo.driver.res,6/19/2015,LAB 1390,10/27/2013,,Y,Y,,,,,,
,CS,LAB,12033,INFCE: Allow messages to file with redundant orders,Completed,3,,"6.0C, 6.07C, 6.08C, 6.1C, 6.13C, 6.14C, 6.15C",5,LAB.C.REQ.xi.ord.filer,6/19/2015,LAB 1603,3/20/2014,,Y,Y,,,,,,
,CS,LAB,12055,LABRES OUT sending result in 5.1.1.2 instead of 5.1.1.1,Completed,3,,"6.0C, 6.07C, 6.08C, 6.1C, 6.13C, 6.14C",4,LAB.C.SPEC.xo.format.hl7.discres.comp,6/19/2015,LAB 1473,12/1/2013,,Y,Y,,,,,,
,CS,LAB,12128,INFCE: RO: NTE comments filing to all OBRs,Submitted,3,,6.07S,,,6/19/2015,,,,,,,,,,,
,CS,LAB,12135,INFCE - SPM|14 can be Sent as a Blank Space when MIC Spec Description Blank,Completed,3,,"6.0C, 6.07C, 6.08C, 6.1C, 6.13C, 6.14C",4,"LAB.C.SPEC.xo.format.hl7.discres.comp, LAB.C.SPEC.xo.format.hl7.discres.nomen",6/19/2015,LAB 1505,1/20/2014,,Y,Y,,,Y,,,
,CS,LAB,12176,INFCE: Extra char added to MSH|2 for v2.5.1 of LAB Results Interface,Completed,3,Y,"6.0C, 6.07C, 6.08C, 6.1C, 6.13C, 6.14C",4,LAB.C.SPEC.xo.format.hl7.discres.nomen,6/19/2015,LAB 1506,2/20/2014,,Y,Y,,,Y,,,
,CS,LAB,12184,LABRES - Allow NPI provider number to be sent,Completed,3,Y,"6.0C, 6.07C, 6.08C, 6.1C, 6.13C, 6.14C, 6.15C",5,LAB.C.SPEC.xo.format.hl7.discres.nomen,6/19/2015,LAB 1584,3/20/2014,,Y,Y,,,Y,,,
,CS,LAB,12230,NMI: OBX-11 incorrect following Preliminary Verified correction,Completed,3,Y,"6.0C, 6.07C, 6.08C, 6.1C, 6.13C, 6.14C",4,LAB.C.SPEC.xo.format.hl7.discres.nomen,6/19/2015,LAB 1508,2/20/2014,,Y,Y,,,Y,,,
,CS,LAB,12232,"LAB:Send Specimen Comments in OBR|13, OBR|31 and OBR|39 as a Single Repetition",Completed,3,Y,"6.0C, 6.07C, 6.08C, 6.1C, 6.13C, 6.14C, 6.15C",,LAB.C.SPEC.xo.format.hl7.discres.comp,6/19/2015,LAB 1678,8/21/2014,,Y,Y,,,,,,
,CS,LAB,12238,NMI: Incorrect Specimen Status and Observ Status on Sensitivity procedure,Completed,3,,"6.0C, 6.07C, 6.08C, 6.1C, 6.13C, 6.14C, 6.15C",5,LAB.C.SPEC.xo.format.hl7.discres.nomen,6/19/2015,LAB 1586,5/15/2014,,Y,Y,,,Y,,,
,CS,LAB,12239,"INFCE: OBR|21 should only contain Lab Site Name, PID|3 should include Acct Num",Completed,3,,"6.0C, 6.07C, 6.08C, 6.1C, 6.13C, 6.14C, 6.15C",5,LAB.C.SPEC.xo.format.hl7.discres.nomen,6/19/2015,LAB 1587,4/17/2014,,Y,Y,,,Y,,,
,CS,LAB,12266,INFCE: Orders following filtered orders remain in FAIL-CREATE status in batch,Submitted,3,,6.07S,,,6/19/2015,,,,,,,,,,,
,CS,LAB,12271,LAB: Populate OBR|3 with Specimen Barcode for MEDINET.SO interface,Submitted,3,,6.07S,,,6/19/2015,,,,,,,,,,,
,CS,LAB,12318,MIC: Sending results for procedures not defined for interface result recipient,Completed,3,,"6.0C, 6.07C, 6.08C, 6.1C, 6.13C, 6.14C, 6.15C",4,LAB.M.SPEC.xo.res.recipient.check,6/19/2015,LAB 1545,3/20/2014,,Y,Y,,,,,,
,CS,LAB,12319,"MU - look to  parameter to determine ""PH"" or ""ACP"" interface type",Completed,3,Y,"6.0C, 6.07C, 6.08C, 6.1C, 6.13C, 6.14C, 6.15C",5,LAB.C.SPEC.xo.format.hl7.discres.nomen,6/19/2015,LAB 1588,5/15/2014,,Y,Y,,,Y,,,
,CS,LAB,12325,INFCE: Set up DG1 Segment in Hook Program for OV orders to OM,Submitted,3,,"6.0S, 6.07S, 6.08S, 6.1S, 6.13S, 6.14S, 6.15S",,,6/19/2015,,,,,,,,,,,
,CS,LAB,12331,INFCE MU - Send organism name in OBX|5.1.5,Completed,3,,"6.0C, 6.07C, 6.08C, 6.1C, 6.13C, 6.14C, 6.15C",5,LAB.C.SPEC.xo.format.hl7.discres.nomen,6/19/2015,LAB 1589,5/15/2014,,Y,Y,,,Y,,,
,CS,LAB,12335,NMI: Incorrect Specimen Status and Observ Status on Sensitivity procedure,Completed,3,,"6.0C, 6.07C, 6.08C, 6.1C, 6.13C, 6.14C, 6.15C",5,LAB.C.SPEC.xo.format.hl7.discres.comp,6/19/2015,LAB 1590,4/17/2014,,Y,Y,,,,,,
,CS,LAB,12336,MIC: Organism prompt recipients not respected for public health interfaces,Completed,3,Y,"6.0C, 6.07C, 6.08C, 6.1C, 6.13C, 6.14C, 6.15C",4,LAB.C.SPEC.xo.format.hl7.discres.nomen,6/19/2015,LAB 1546,3/20/2014,,Y,Y,,,Y,,,
,CS,LAB,12348,ARRA INFCE: MSH Namespace ID Type changes,Completed,3,Y,"6.0C, 6.07C, 6.08C, 6.1C, 6.13C, 6.14C, 6.15C",5,"LAB.C.SPEC.xo.format.hl7.discres.nomen, LAB.TOOL.BOX.init.x.msg.type",6/19/2015,LAB 1591,4/17/2014,,Y,Y,,,Y,,,
,CS,LAB,12360,LAB: Additional fields for LAB Results Reporting Interface,Submitted,3,,6.07S,,,6/19/2015,,,,,,,,,,,
,CS,LAB,12409,"INFCE: Corrected LAB Group Tests Not Sending ""C"" in OBR|25 (Public Health)",Completed,3,Y,"6.0C, 6.07C, 6.08C, 6.1C, 6.13C, 6.14C, 6.15C",,LAB.C.SPEC.xo.format.hl7.discres.nomen,6/19/2015,LAB 1679,8/21/2014,,Y,Y,,,Y,,,
,CS,LAB,12411,INFCE: Multiple buffering causes performance issues,Completed,3,Y,"6.0C, 6.07C, 6.08C, 6.1C, 6.13C, 6.14C, 6.15C",5,"LAB.C.SPEC.xo.format.hl7.discres.comp, LAB.C.SPEC.xo.format.hl7.discres.nomen, LAB.C.SPEC.xo.format.res.hl7.comp",6/19/2015,LAB 1593,4/17/2014,,Y,Y,,,Y,,,
,CS,LAB,12413,LIS/NMI: Record buffering for results-out interfaces causes high server load,Completed,3,,"6.0C, 6.07C, 6.08C, 6.1C, 6.13C, 6.14C, 6.15C",5,"LAB.B.SPEC.xo.res.recipient.check, LAB.L.SPEC.xo.res.recipient.check, LAB.M.SPEC.xo.res.recipient.check",6/19/2015,LAB 1578,5/29/2014,,Y,Y,,,Y,LAB,,
,CS,LAB,12450,INFCE: Unable To Confirm Facility for Inbound Results Interface (POC),Submitted,3,,"6.0S, 6.07S, 6.08S, 6.1S, 6.13S",,,6/19/2015,,,,,,,,,,,
,CS,LAB,12454,INFCE: Performing Site Result Code not being sent in OBX|16.2,Submitted,3,,6.07S,,,6/19/2015,,,,,,,,,,,
,CS,LAB,12457,INFCE: MIC organism skipped if orphaned brace with no text after organism,Completed,3,,"6.0C, 6.07C, 6.08C, 6.1C, 6.13C, 6.14C, 6.15C",,"LAB.C.SPEC.xo.format.hl7.discres.comp, LAB.C.SPEC.xo.format.hl7.discres.nomen, LAB.C.SPEC.xo.format.res.hl7.comp",6/19/2015,LAB 1781,11/20/2014,,Y,Y,,,Y,,,
,CS,LAB,12466,INFCE: LAB RESULTS Incorrect status can be sent in OBX|11 for MIC specimens,Completed,3,Y,"6.0C, 6.07C, 6.08C, 6.1C, 6.13C, 6.14C, 6.15C",5,"LAB.C.SPEC.xo.format.hl7.discres.comp, LAB.C.SPEC.xo.format.hl7.discres.nomen",6/19/2015,LAB 1615,5/15/2014,,Y,Y,,,Y,,,
,CS,LAB,12482,INFCE: LAB RESULTS Incorrect status can be sent in OBX|11 for MIC specimens,,3,,,,"LAB.C.SPEC.xo.format.hl7.discres.comp, LAB.C.SPEC.xo.format.hl7.discres.nomen",6/19/2015,,,,,,,,Y,,,
,CS,LAB,12495,INFCE: Cancel Comments missing from 'nomen' MIC messages to OV,Completed,3,,"6.0C, 6.07C, 6.08C, 6.1C, 6.13C, 6.14C, 6.15C",,LAB.C.SPEC.xo.format.hl7.discres.nomen,6/19/2015,LAB 1695,9/18/2014,,Y,Y,,,Y,,,
,CS,LAB,12508,INFCE - Make use of provider ID type parameter for LAB orders interfaces,Completed,3,Y,"6.0C, 6.07C, 6.08C, 6.1C, 6.13C, 6.14C, 6.15C",,LAB.C.REQ.xo.format.ord.hl7.comp,6/19/2015,LAB 1782,11/20/2014,,Y,Y,,,,,,
,CS,LAB,12509,"INFCE - Add insurance segments (DG1, GT1, IN1) to LAB orders outbound messages",Completed,3,,"6.0C, 6.07C, 6.08C, 6.1C, 6.13C, 6.14C, 6.15C",,LAB.C.REQ.xo.format.ord.hl7.comp,6/19/2015,LAB 1783,11/20/2014,,Y,Y,,,,,,
,CS,LAB,12519,"INFCE: When Collection Time is ""UNK"", Populate ""0000""",Completed,3,,"6.0C, 6.07C, 6.08C, 6.1C, 6.13C, 6.14C, 6.15C",,LAB.C.SPEC.xo.format.hl7.discres.nomen,6/19/2015,LAB 1696,9/18/2014,,Y,Y,,,Y,,,"If patched, see shipping ring for correct code"
,CS,LAB,12523,INFCE: SPM|4 generates component 4 and 5 incorrectly - v2.5.1 (LAB),Completed,3,,"6.0C, 6.07C, 6.08C, 6.1C, 6.13C, 6.14C, 6.15C",,LAB.C.SPEC.xo.format.hl7.discres.nomen,6/19/2015,LAB 1697,9/18/2014,,Y,Y,,,Y,,,
,CS,LAB,12526,INFCE: LABRES Infce No Longer Posting Degree to MIC OBR|16.7 & ORC|12.7,Completed,3,,"6.0C, 6.07C, 6.08C, 6.1C, 6.13C, 6.14C, 6.15C",,LAB.C.SPEC.xo.format.hl7.discres.nomen,6/19/2015,LAB 1784,11/20/2014,,Y,Y,,,Y,,,
,CS,LAB,12533,"INFCE: SPM|2.1.2.2, OBR|32.1.1.9 blank if sending app parameter is blank",Completed,3,,"6.0C, 6.07C, 6.08C, 6.1C, 6.13C, 6.14C, 6.15C",,LAB.C.SPEC.xo.format.hl7.discres.nomen,6/19/2015,LAB 1785,11/20/2014,,Y,Y,,,Y,,,
,CS,LAB,12540,"Infce: Send ""F"" in OBR|25 if previous result was ""NP""",Completed,3,,"6.0C, 6.07C, 6.08C, 6.1C, 6.13C, 6.14C, 6.15C",,"LAB.C.SPEC.xo.format.hl7.discres.comp, LAB.C.SPEC.xo.format.hl7.discres.nomen",6/19/2015,LAB 1680,8/21/2014,,Y,Y,,,Y,,,
,CS,LAB,12556,NMI: ROSR - Abnormal flag not appearing for Multiple Type Prompts,Completed,3,,"6.0C, 6.07C, 6.08C, 6.1C, 6.13C, 6.14C, 6.15C",,"LAB.C.SPEC.xo.format.hl7.discres.comp, LAB.C.SPEC.xo.format.res.hl7.comp",6/19/2015,LAB 1996,4/16/2015,Y,,,,,,,,
,CS,LAB,12608,INFCE: LAB PH - Remove Scale Type check in processing Prompt Result in OBX|5,Completed,3,Y,"6.0C, 6.07C, 6.08C, 6.1C, 6.13C, 6.14C, 6.15C",,"LAB.C.SPEC.xo.format.hl7.discres.nomen, LAB.TOOL.BOX.init.x.msg.type",6/19/2015,LAB 1738,11/20/2014,,Y,Y,,,Y,,,
,CS,LAB,12639,LAB: Tests Deleted off LAB req continue to display incorrect results in EAR,Completed,2,Y,"6.0C, 6.07C, 6.08C",,LAB.C.SPEC.xo.format.hl7.discres.mpm,6/19/2015,LAB 1786,7/29/2014,,Y,Y,,,,,,
,CS,LAB,12640,INFCE: LAB Drivers don't set up MIS Time Zone Offset until after Msg Formatted,Completed,3,,"6.0C, 6.07C, 6.08C, 6.1C, 6.13C, 6.14C, 6.15C",,"LAB.C.REQ.xo.driver.ord, LAB.C.REQ.xo.format.ord.hl7.comp, LAB.C.SPEC.xo.driver.res, LAB.C.SPEC.xo.format.hl7.discres.comp, LAB.C.SPEC.xo.format.hl7.discres.mpm, LAB.C.SPEC.xo.format.res.hl7.comp",6/19/2015,LAB 1787,12/18/2014,,Y,Y,,,,,,
,CS,LAB,12643,"INFCE: Restrictions for LAB RES driver FAIL-SEND msgs if Holder Msg is ""Y""",Submitted,3,,6.07S,,,6/19/2015,,,,,,,,,,,
,CS,LAB,12647,INFCE: Remove Number Check for Patient Names in LAB Results to PH,Completed,3,,"6.0C, 6.07C, 6.08C, 6.1C, 6.13C, 6.14C, 6.15C",,LAB.C.SPEC.xo.format.hl7.discres.nomen,6/19/2015,LAB 1918,,,Y,Y,,,Y,,,
,CS,LAB,12660,NMI/MIC: MIC Absence of Findings Prompt not referenced in NMI message,Completed,3,,"6.0C, 6.07C, 6.08C, 6.1C, 6.13C, 6.14C, 6.15C",,LAB.C.SPEC.xo.format.hl7.discres.nomen,6/19/2015,LAB 1698,11/20/2014,,Y,Y,,,Y,,,
,CS,LAB,12664,"DDP 19300: Formatter changes to support Collection Method, Amount, & Unit",Completed,3,Y,"6.0C, 6.07C, 6.08C, 6.1C, 6.13C, 6.14C, 6.15C",,"LAB.C.SPEC.xo.format.hl7.discres.nomen, LAB.TOOL.BOX.init.x.msg.type",6/19/2015,LAB 1739,9/18/2014,,Y,Y,,,Y,,,
,CS,LAB,12680,INFCE: Tests Deleted off LAB continue to send incorrect results to OV,Submitted,3,Y,"6.0S, 6.07S, 6.08S",,,6/19/2015,,,,,,,,Y,,,
,CS,LAB,12687,INFCE: MIC PH Results - Send MIC Specimen description nomenclature in SPM|8,Completed,3,Y,"6.0C, 6.07C, 6.08C, 6.1C, 6.13C, 6.14C, 6.15C",,"LAB.C.SPEC.xo.format.hl7.discres.nomen, LAB.TOOL.BOX.init.x.msg.type",6/19/2015,LAB 1859,1/15/2015,,Y,Y,,,Y,,,
,CS,LAB,12691,"LAB: RES OV Interface leaving audit on G-type tests, spec. stuck at RES status",Draft,3,,"6.0D, 6.07D, 6.08D, 6.1D, 6.14D, 6.15D",,"LAB.C.SPEC.xo.format.hl7.discres.comp, LAB.C.SPEC.xo.format.hl7.discres.nomen, LAB.C.SPEC.xo.format.res.hl7.comp",6/19/2015,,8/20/2015,,,,,,Y,,,
,CS,LAB,12706,NMI: OBR|25 not sending correct flag for corrected MIC results,Completed,3,Y,"6.0C, 6.07C, 6.08C, 6.1C, 6.13C, 6.14C, 6.15C",,LAB.C.SPEC.xo.format.hl7.discres.nomen,6/19/2015,LAB 1919,3/19/2015,,Y,Y,,,Y,,,
